id,fk_provider_id,fk_type_id,slogan,description,short_description,keywords,language_spoken1,language_spoken2,language_spoken3,language_spoken4,image_path_1,image_path_2,image_path_3,image_path_4,video_image_1,video_image_2,reg_date
140,40,13,Progressive 3rd generation secured line,"Lorem ipsum dolor sit amet, consectetuer adipiscing elit. Proin risus. Praesent lectus.

Vestibulum quam sapien, varius ut, blandit non, interdum in, ante. Vestibulum ante ipsum primis in faucibus orci luctus et ultrices posuere cubilia Curae; Duis faucibus accumsan odio. Curabitur convallis.",Praesent id massa id nisl venenatis lacinia.,21 and over,Bislama,Khmer,Georgian,Italian,http://dummyimage.com/118x159.png/cc0000/ffffff,,,http://dummyimage.com/241x200.bmp/dddddd/000000,http://dummyimage.com/246x228.jpg/5fa2dd/ffffff,http://dummyimage.com/128x155.png/5fa2dd/ffffff,4/13/2017
141,41,26,Sharable homogeneous intranet,"Praesent blandit. Nam nulla. Integer pede justo, lacinia eget, tincidunt eget, tempus vel, pede.",Aenean fermentum.,walking,Marathi,Somali,Sotho,Swedish,http://dummyimage.com/231x138.jpg/5fa2dd/ffffff,http://dummyimage.com/263x273.bmp/dddddd/000000,,http://dummyimage.com/221x210.png/dddddd/000000,,,4/13/2017
142,42,16,Optional 6th generation utilisation,"Integer ac leo. Pellentesque ultrices mattis odio. Donec vitae nisi.

Nam ultrices, libero non mattis pulvinar, nulla pede ullamcorper augue, a suscipit nulla elit ac nulla. Sed vel enim sit amet nunc viverra dapibus. Nulla suscipit ligula in lacus.",Nunc rhoncus dui vel sem.,hiking,Tswana,Marathi,West Frisian,Malay,http://dummyimage.com/160x110.jpg/dddddd/000000,http://dummyimage.com/201x251.jpg/cc0000/ffffff,,,http://dummyimage.com/221x213.png/ff4444/ffffff,,5/31/2016
143,43,18,Persevering context-sensitive workforce,Integer ac leo. Pellentesque ultrices mattis odio. Donec vitae nisi.,"Praesent blandit. Nam nulla. Integer pede justo, lacinia eget, tincidunt eget, tempus vel, pede.",dogs,Marathi,Quechua,Somali,Persian,http://dummyimage.com/178x113.png/ff4444/ffffff,http://dummyimage.com/264x245.bmp/ff4444/ffffff,http://dummyimage.com/219x230.png/cc0000/ffffff,http://dummyimage.com/249x238.jpg/5fa2dd/ffffff,http://dummyimage.com/233x163.jpg/cc0000/ffffff,,9/20/2016
144,44,26,Configurable mobile superstructure,"In hac habitasse platea dictumst. Etiam faucibus cursus urna. Ut tellus.

Nulla ut erat id mauris vulputate elementum. Nullam varius. Nulla facilisi.","Maecenas tristique, est et tempus semper, est quam pharetra magna, ac consequat metus sapien ut nunc. Vestibulum ante ipsum primis in faucibus orci luctus et ultrices posuere cubilia Curae; Mauris viverra diam vitae quam. Suspendisse potenti.",hiking,Hebrew,Dari,Danish,Luxembourgish,http://dummyimage.com/207x139.jpg/ff4444/ffffff,,,,http://dummyimage.com/128x199.bmp/5fa2dd/ffffff,http://dummyimage.com/162x211.bmp/dddddd/000000,6/17/2016
145,45,30,Multi-layered 24/7 instruction set,"Curabitur in libero ut massa volutpat convallis. Morbi odio odio, elementum eu, interdum eu, tincidunt in, leo. Maecenas pulvinar lobortis est.","Lorem ipsum dolor sit amet, consectetuer adipiscing elit. Proin interdum mauris non ligula pellentesque ultrices.",walking,Norwegian,Thai,Khmer,Korean,http://dummyimage.com/142x166.bmp/5fa2dd/ffffff,http://dummyimage.com/268x257.bmp/dddddd/000000,,http://dummyimage.com/247x206.bmp/5fa2dd/ffffff,http://dummyimage.com/180x102.jpg/ff4444/ffffff,,5/11/2016
146,46,12,Virtual bi-directional capacity,"Nullam sit amet turpis elementum ligula vehicula consequat. Morbi a ipsum. Integer a nibh.

In quis justo. Maecenas rhoncus aliquam lacus. Morbi quis tortor id nulla ultrices aliquet.",Vestibulum rutrum rutrum neque. Aenean auctor gravida sem.,tour,Spanish,Kurdish,Hindi,Korean,http://dummyimage.com/166x234.jpg/cc0000/ffffff,,,http://dummyimage.com/217x226.png/cc0000/ffffff,http://dummyimage.com/249x125.bmp/dddddd/000000,,10/22/2016
147,47,25,Business-focused modular encoding,Pellentesque at nulla. Suspendisse potenti. Cras in purus eu magna vulputate luctus.,"Mauris enim leo, rhoncus sed, vestibulum sit amet, cursus id, turpis.",food,Afrikaans,Papiamento,Belarusian,Arabic,http://dummyimage.com/228x220.bmp/ff4444/ffffff,http://dummyimage.com/258x254.bmp/cc0000/ffffff,http://dummyimage.com/204x220.png/ff4444/ffffff,http://dummyimage.com/229x239.png/ff4444/ffffff,,,3/19/2017
148,48,20,Total disintermediate info-mediaries,"Curabitur in libero ut massa volutpat convallis. Morbi odio odio, elementum eu, interdum eu, tincidunt in, leo. Maecenas pulvinar lobortis est.

Phasellus sit amet erat. Nulla tempus. Vivamus in felis eu sapien cursus vestibulum.",Vestibulum ante ipsum primis in faucibus orci luctus et ultrices posuere cubilia Curae; Duis faucibus accumsan odio. Curabitur convallis.,tour,West Frisian,Tswana,New Zealand Sign Language,Gagauz,http://dummyimage.com/190x249.png/cc0000/ffffff,http://dummyimage.com/242x263.png/cc0000/ffffff,http://dummyimage.com/228x248.jpg/cc0000/ffffff,,http://dummyimage.com/244x236.bmp/cc0000/ffffff,http://dummyimage.com/213x162.bmp/ff4444/ffffff,10/3/2016
149,49,30,Multi-tiered intermediate framework,"Proin interdum mauris non ligula pellentesque ultrices. Phasellus id sapien in sapien iaculis congue. Vivamus metus arcu, adipiscing molestie, hendrerit at, vulputate vitae, nisl.

Aenean lectus. Pellentesque eget nunc. Donec quis orci eget orci vehicula condimentum.",Morbi ut odio.,dogs,Polish,Tswana,Kyrgyz,Dhivehi,http://dummyimage.com/209x116.bmp/cc0000/ffffff,,,http://dummyimage.com/229x244.jpg/dddddd/000000,,,4/7/2017
150,50,17,Virtual eco-centric migration,"Donec diam neque, vestibulum eget, vulputate ut, ultrices vel, augue. Vestibulum ante ipsum primis in faucibus orci luctus et ultrices posuere cubilia Curae; Donec pharetra, magna vestibulum aliquet ultrices, erat tortor sollicitudin mi, sit amet lobortis sapien sapien non mi. Integer ac neque.","Nulla neque libero, convallis eget, eleifend luctus, ultricies eu, nibh. Quisque id justo sit amet sapien dignissim vestibulum.",21 and over,Azeri,Dari,Moldovan,Yiddish,http://dummyimage.com/213x172.png/ff4444/ffffff,http://dummyimage.com/211x230.jpg/dddddd/000000,http://dummyimage.com/161x191.jpg/cc0000/ffffff,http://dummyimage.com/227x220.bmp/dddddd/000000,,,7/28/2016
151,51,28,Horizontal dynamic customer loyalty,"Quisque id justo sit amet sapien dignissim vestibulum. Vestibulum ante ipsum primis in faucibus orci luctus et ultrices posuere cubilia Curae; Nulla dapibus dolor vel est. Donec odio justo, sollicitudin ut, suscipit a, feugiat et, eros.",Proin eu mi.,surfing,Estonian,Danish,Dari,Northern Sotho,http://dummyimage.com/206x119.png/ff4444/ffffff,http://dummyimage.com/259x231.bmp/cc0000/ffffff,http://dummyimage.com/246x225.jpg/cc0000/ffffff,,http://dummyimage.com/179x220.jpg/5fa2dd/ffffff,,7/18/2016
152,52,22,Team-oriented web-enabled hierarchy,"Aenean fermentum. Donec ut mauris eget massa tempor convallis. Nulla neque libero, convallis eget, eleifend luctus, ultricies eu, nibh.

Quisque id justo sit amet sapien dignissim vestibulum. Vestibulum ante ipsum primis in faucibus orci luctus et ultrices posuere cubilia Curae; Nulla dapibus dolor vel est. Donec odio justo, sollicitudin ut, suscipit a, feugiat et, eros.",Suspendisse potenti.,drinks,Portuguese,Assamese,Yiddish,Punjabi,http://dummyimage.com/204x107.jpg/ff4444/ffffff,http://dummyimage.com/298x265.png/ff4444/ffffff,,,http://dummyimage.com/190x225.bmp/cc0000/ffffff,http://dummyimage.com/216x102.bmp/cc0000/ffffff,8/22/2016
153,53,14,Business-focused impactful access,"Vestibulum ac est lacinia nisi venenatis tristique. Fusce congue, diam id ornare imperdiet, sapien urna pretium nisl, ut volutpat sapien arcu sed augue. Aliquam erat volutpat.",Nulla mollis molestie lorem.,luau,Indonesian,Malayalam,Amharic,Greek,http://dummyimage.com/222x207.bmp/5fa2dd/ffffff,,http://dummyimage.com/189x246.png/dddddd/000000,http://dummyimage.com/241x239.png/5fa2dd/ffffff,http://dummyimage.com/198x137.bmp/dddddd/000000,http://dummyimage.com/111x196.jpg/dddddd/000000,6/21/2016
154,54,20,Managed mobile firmware,Aenean lectus. Pellentesque eget nunc. Donec quis orci eget orci vehicula condimentum.,"Quisque porta volutpat erat. Quisque erat eros, viverra eget, congue eget, semper rutrum, nulla.",eating,Persian,Norwegian,Tsonga,Hiri Motu,http://dummyimage.com/189x181.bmp/dddddd/000000,http://dummyimage.com/261x289.jpg/5fa2dd/ffffff,,http://dummyimage.com/237x218.jpg/ff4444/ffffff,http://dummyimage.com/225x171.jpg/dddddd/000000,,8/25/2016
155,55,12,Multi-lateral value-added help-desk,"Proin interdum mauris non ligula pellentesque ultrices. Phasellus id sapien in sapien iaculis congue. Vivamus metus arcu, adipiscing molestie, hendrerit at, vulputate vitae, nisl.","Pellentesque ultrices mattis odio. Donec vitae nisi. Nam ultrices, libero non mattis pulvinar, nulla pede ullamcorper augue, a suscipit nulla elit ac nulla.",monk seal,Persian,Bengali,Māori,Nepali,http://dummyimage.com/210x120.png/dddddd/000000,,http://dummyimage.com/201x196.jpg/ff4444/ffffff,http://dummyimage.com/221x223.png/5fa2dd/ffffff,,,9/29/2016
156,56,3,Quality-focused eco-centric service-desk,"Maecenas tristique, est et tempus semper, est quam pharetra magna, ac consequat metus sapien ut nunc. Vestibulum ante ipsum primis in faucibus orci luctus et ultrices posuere cubilia Curae; Mauris viverra diam vitae quam. Suspendisse potenti.

Nullam porttitor lacus at turpis. Donec posuere metus vitae ipsum. Aliquam non mauris.",Aenean lectus. Pellentesque eget nunc.,hawaiian,Indonesian,Kurdish,West Frisian,Pashto,http://dummyimage.com/208x104.bmp/cc0000/ffffff,http://dummyimage.com/289x286.png/ff4444/ffffff,,http://dummyimage.com/215x230.png/dddddd/000000,http://dummyimage.com/177x200.jpg/cc0000/ffffff,,6/3/2016
157,57,23,Visionary radical success,"Proin eu mi. Nulla ac enim. In tempor, turpis nec euismod scelerisque, quam turpis adipiscing lorem, vitae mattis nibh ligula nec sem.

Duis aliquam convallis nunc. Proin at turpis a pede posuere nonummy. Integer non velit.","Donec ut mauris eget massa tempor convallis. Nulla neque libero, convallis eget, eleifend luctus, ultricies eu, nibh. Quisque id justo sit amet sapien dignissim vestibulum.",snorkeling,Macedonian,Northern Sotho,Khmer,Yiddish,http://dummyimage.com/132x207.jpg/cc0000/ffffff,http://dummyimage.com/231x235.bmp/dddddd/000000,http://dummyimage.com/217x243.png/dddddd/000000,,,,10/2/2016
158,58,21,Cross-platform bandwidth-monitored instruction set,"Quisque porta volutpat erat. Quisque erat eros, viverra eget, congue eget, semper rutrum, nulla. Nunc purus.","Proin interdum mauris non ligula pellentesque ultrices. Phasellus id sapien in sapien iaculis congue. Vivamus metus arcu, adipiscing molestie, hendrerit at, vulputate vitae, nisl.",drinks,Dari,Czech,Kurdish,Tetum,http://dummyimage.com/125x237.png/dddddd/000000,http://dummyimage.com/251x284.jpg/dddddd/000000,http://dummyimage.com/162x208.png/dddddd/000000,http://dummyimage.com/219x203.bmp/ff4444/ffffff,http://dummyimage.com/197x193.jpg/cc0000/ffffff,,11/7/2016
159,59,22,Persevering 4th generation functionalities,Integer tincidunt ante vel ipsum. Praesent blandit lacinia erat. Vestibulum sed magna at nunc commodo placerat.,"Morbi odio odio, elementum eu, interdum eu, tincidunt in, leo.",luau,Albanian,Malayalam,Kannada,Greek,http://dummyimage.com/239x220.jpg/5fa2dd/ffffff,,http://dummyimage.com/240x214.png/cc0000/ffffff,http://dummyimage.com/221x211.jpg/dddddd/000000,,,3/17/2017
160,60,19,Face to face fresh-thinking success,Integer ac leo. Pellentesque ultrices mattis odio. Donec vitae nisi.,Proin at turpis a pede posuere nonummy.,tour,Kurdish,Kazakh,Gagauz,Spanish,http://dummyimage.com/149x137.bmp/cc0000/ffffff,http://dummyimage.com/225x257.jpg/5fa2dd/ffffff,,http://dummyimage.com/231x219.png/5fa2dd/ffffff,http://dummyimage.com/179x169.bmp/cc0000/ffffff,,9/26/2016
161,61,22,Managed transitional architecture,"Duis aliquam convallis nunc. Proin at turpis a pede posuere nonummy. Integer non velit.

Donec diam neque, vestibulum eget, vulputate ut, ultrices vel, augue. Vestibulum ante ipsum primis in faucibus orci luctus et ultrices posuere cubilia Curae; Donec pharetra, magna vestibulum aliquet ultrices, erat tortor sollicitudin mi, sit amet lobortis sapien sapien non mi. Integer ac neque.","Donec semper sapien a libero. Nam dui. Proin leo odio, porttitor id, consequat in, consequat ut, nulla.",no kids,Hungarian,Guaraní,Japanese,Bosnian,http://dummyimage.com/119x211.png/5fa2dd/ffffff,,,http://dummyimage.com/209x243.bmp/dddddd/000000,,,10/1/2016
162,62,23,Team-oriented actuating software,"In sagittis dui vel nisl. Duis ac nibh. Fusce lacus purus, aliquet at, feugiat non, pretium quis, lectus.","Lorem ipsum dolor sit amet, consectetuer adipiscing elit. Proin risus.",biking,Nepali,Moldovan,Dhivehi,Belarusian,http://dummyimage.com/157x169.png/5fa2dd/ffffff,http://dummyimage.com/256x284.bmp/cc0000/ffffff,,http://dummyimage.com/234x216.bmp/dddddd/000000,http://dummyimage.com/150x117.bmp/cc0000/ffffff,,10/10/2016
163,63,16,Monitored full-range data-warehouse,In congue. Etiam justo. Etiam pretium iaculis justo.,"Vivamus metus arcu, adipiscing molestie, hendrerit at, vulputate vitae, nisl.",luau,Chinese,Tok Pisin,Guaraní,Bosnian,http://dummyimage.com/111x128.bmp/dddddd/000000,http://dummyimage.com/298x253.bmp/cc0000/ffffff,,http://dummyimage.com/208x247.jpg/ff4444/ffffff,,http://dummyimage.com/233x217.bmp/ff4444/ffffff,4/21/2016
164,64,25,De-engineered transitional website,"Curabitur gravida nisi at nibh. In hac habitasse platea dictumst. Aliquam augue quam, sollicitudin vitae, consectetuer eget, rutrum at, lorem.

Integer tincidunt ante vel ipsum. Praesent blandit lacinia erat. Vestibulum sed magna at nunc commodo placerat.",Nulla justo. Aliquam quis turpis eget elit sodales scelerisque.,walking,Belarusian,Korean,Dari,Croatian,http://dummyimage.com/105x206.jpg/5fa2dd/ffffff,http://dummyimage.com/239x208.jpg/5fa2dd/ffffff,http://dummyimage.com/184x226.bmp/cc0000/ffffff,,,,1/31/2017
165,65,14,Monitored high-level concept,"Vestibulum ac est lacinia nisi venenatis tristique. Fusce congue, diam id ornare imperdiet, sapien urna pretium nisl, ut volutpat sapien arcu sed augue. Aliquam erat volutpat.

In congue. Etiam justo. Etiam pretium iaculis justo.","Lorem ipsum dolor sit amet, consectetuer adipiscing elit. Proin interdum mauris non ligula pellentesque ultrices.",snorkeling,Marathi,Bengali,Azeri,Kurdish,http://dummyimage.com/165x248.png/ff4444/ffffff,http://dummyimage.com/275x205.png/ff4444/ffffff,http://dummyimage.com/180x227.jpg/cc0000/ffffff,http://dummyimage.com/212x246.bmp/dddddd/000000,http://dummyimage.com/225x156.jpg/cc0000/ffffff,,10/21/2016
166,66,23,Operative asynchronous functionalities,Etiam vel augue. Vestibulum rutrum rutrum neque. Aenean auctor gravida sem.,"Aliquam augue quam, sollicitudin vitae, consectetuer eget, rutrum at, lorem. Integer tincidunt ante vel ipsum. Praesent blandit lacinia erat.",cooking,Gagauz,Kashmiri,Dzongkha,Kashmiri,http://dummyimage.com/227x129.png/cc0000/ffffff,http://dummyimage.com/251x267.bmp/cc0000/ffffff,http://dummyimage.com/167x168.bmp/cc0000/ffffff,,http://dummyimage.com/113x143.jpg/ff4444/ffffff,http://dummyimage.com/137x156.bmp/dddddd/000000,10/7/2016
167,67,26,Enhanced holistic analyzer,"Cras mi pede, malesuada in, imperdiet et, commodo vulputate, justo. In blandit ultrices enim. Lorem ipsum dolor sit amet, consectetuer adipiscing elit.","Donec ut mauris eget massa tempor convallis. Nulla neque libero, convallis eget, eleifend luctus, ultricies eu, nibh. Quisque id justo sit amet sapien dignissim vestibulum.",restaurant,Punjabi,English,Yiddish,Polish,http://dummyimage.com/240x120.jpg/cc0000/ffffff,http://dummyimage.com/272x203.bmp/ff4444/ffffff,http://dummyimage.com/159x190.jpg/5fa2dd/ffffff,,,,1/21/2017
168,68,12,Balanced modular knowledge base,Aliquam quis turpis eget elit sodales scelerisque. Mauris sit amet eros. Suspendisse accumsan tortor quis turpis.,Aliquam quis turpis eget elit sodales scelerisque. Mauris sit amet eros.,no kids,Hungarian,Guaraní,Italian,Somali,http://dummyimage.com/145x226.png/dddddd/000000,,,http://dummyimage.com/207x250.jpg/dddddd/000000,,,6/22/2016
169,69,13,Face to face content-based help-desk,"Quisque id justo sit amet sapien dignissim vestibulum. Vestibulum ante ipsum primis in faucibus orci luctus et ultrices posuere cubilia Curae; Nulla dapibus dolor vel est. Donec odio justo, sollicitudin ut, suscipit a, feugiat et, eros.

Vestibulum ac est lacinia nisi venenatis tristique. Fusce congue, diam id ornare imperdiet, sapien urna pretium nisl, ut volutpat sapien arcu sed augue. Aliquam erat volutpat.",In quis justo. Maecenas rhoncus aliquam lacus. Morbi quis tortor id nulla ultrices aliquet.,art,Assamese,Kannada,Gujarati,Montenegrin,http://dummyimage.com/214x198.png/dddddd/000000,http://dummyimage.com/291x276.png/cc0000/ffffff,http://dummyimage.com/176x203.png/dddddd/000000,,http://dummyimage.com/114x233.bmp/ff4444/ffffff,,6/3/2016
170,70,27,Business-focused discrete analyzer,"Maecenas leo odio, condimentum id, luctus nec, molestie sed, justo. Pellentesque viverra pede ac diam. Cras pellentesque volutpat dui.",Etiam faucibus cursus urna. Ut tellus.,biking,Malayalam,Moldovan,Kashmiri,Albanian,http://dummyimage.com/211x137.jpg/ff4444/ffffff,http://dummyimage.com/261x229.bmp/ff4444/ffffff,http://dummyimage.com/197x215.jpg/ff4444/ffffff,,,http://dummyimage.com/168x198.png/ff4444/ffffff,2/3/2017
171,71,28,Grass-roots transitional benchmark,"Integer tincidunt ante vel ipsum. Praesent blandit lacinia erat. Vestibulum sed magna at nunc commodo placerat.

Praesent blandit. Nam nulla. Integer pede justo, lacinia eget, tincidunt eget, tempus vel, pede.",Duis consequat dui nec nisi volutpat eleifend. Donec ut dolor. Morbi vel lectus in quam fringilla rhoncus.,21 and over,Bengali,Luxembourgish,Gagauz,Arabic,http://dummyimage.com/239x176.png/ff4444/ffffff,,http://dummyimage.com/214x170.jpg/ff4444/ffffff,,,,4/14/2017
172,72,15,Compatible discrete budgetary management,Cras non velit nec nisi vulputate nonummy. Maecenas tincidunt lacus at velit. Vivamus vel nulla eget eros elementum pellentesque.,Aliquam erat volutpat. In congue. Etiam justo.,farm,Japanese,Northern Sotho,Marathi,Yiddish,http://dummyimage.com/159x203.png/cc0000/ffffff,http://dummyimage.com/200x254.jpg/dddddd/000000,http://dummyimage.com/180x177.jpg/dddddd/000000,http://dummyimage.com/218x239.png/5fa2dd/ffffff,,,6/29/2016
173,73,1,Fundamental encompassing capability,"Maecenas tristique, est et tempus semper, est quam pharetra magna, ac consequat metus sapien ut nunc. Vestibulum ante ipsum primis in faucibus orci luctus et ultrices posuere cubilia Curae; Mauris viverra diam vitae quam. Suspendisse potenti.

Nullam porttitor lacus at turpis. Donec posuere metus vitae ipsum. Aliquam non mauris.",Donec semper sapien a libero. Nam dui.,tour,Thai,West Frisian,Tetum,Punjabi,http://dummyimage.com/203x202.png/cc0000/ffffff,http://dummyimage.com/260x200.png/dddddd/000000,http://dummyimage.com/209x233.bmp/5fa2dd/ffffff,,,,10/22/2016
174,74,19,Progressive tertiary strategy,Duis aliquam convallis nunc. Proin at turpis a pede posuere nonummy. Integer non velit.,Nulla facilisi. Cras non velit nec nisi vulputate nonummy.,snorkeling,Northern Sotho,Zulu,Tetum,Kashmiri,http://dummyimage.com/227x245.png/cc0000/ffffff,http://dummyimage.com/235x272.png/ff4444/ffffff,,http://dummyimage.com/226x219.png/ff4444/ffffff,,,11/26/2016
175,75,15,Balanced leading edge paradigm,"Nulla ut erat id mauris vulputate elementum. Nullam varius. Nulla facilisi.

Cras non velit nec nisi vulputate nonummy. Maecenas tincidunt lacus at velit. Vivamus vel nulla eget eros elementum pellentesque.","Proin leo odio, porttitor id, consequat in, consequat ut, nulla. Sed accumsan felis. Ut at dolor quis odio consequat varius.",21 and over,Hungarian,Nepali,Bosnian,Greek,http://dummyimage.com/215x231.jpg/cc0000/ffffff,http://dummyimage.com/289x205.png/ff4444/ffffff,,,,,3/30/2017
176,76,6,Quality-focused asymmetric archive,"Mauris enim leo, rhoncus sed, vestibulum sit amet, cursus id, turpis. Integer aliquet, massa id lobortis convallis, tortor risus dapibus augue, vel accumsan tellus nisi eu orci. Mauris lacinia sapien quis libero.

Nullam sit amet turpis elementum ligula vehicula consequat. Morbi a ipsum. Integer a nibh.",Sed ante. Vivamus tortor. Duis mattis egestas metus.,surfing,Quechua,Oriya,Bislama,Albanian,http://dummyimage.com/145x228.png/dddddd/000000,,http://dummyimage.com/211x206.jpg/5fa2dd/ffffff,,,,8/17/2016
177,77,4,Ergonomic reciprocal knowledge base,"Phasellus sit amet erat. Nulla tempus. Vivamus in felis eu sapien cursus vestibulum.

Proin eu mi. Nulla ac enim. In tempor, turpis nec euismod scelerisque, quam turpis adipiscing lorem, vitae mattis nibh ligula nec sem.",Morbi ut odio.,hiking,Maltese,Danish,Mongolian,Lithuanian,http://dummyimage.com/100x183.bmp/ff4444/ffffff,,http://dummyimage.com/176x196.jpg/ff4444/ffffff,,http://dummyimage.com/248x132.bmp/5fa2dd/ffffff,,8/10/2016
178,78,8,Optional foreground artificial intelligence,"Cras non velit nec nisi vulputate nonummy. Maecenas tincidunt lacus at velit. Vivamus vel nulla eget eros elementum pellentesque.

Quisque porta volutpat erat. Quisque erat eros, viverra eget, congue eget, semper rutrum, nulla. Nunc purus.",Maecenas rhoncus aliquam lacus.,cooking,Marathi,Malay,Spanish,Kazakh,http://dummyimage.com/248x176.bmp/ff4444/ffffff,,,http://dummyimage.com/220x217.jpg/dddddd/000000,http://dummyimage.com/220x138.jpg/cc0000/ffffff,,4/12/2017
179,79,1,Inverse disintermediate archive,"Proin eu mi. Nulla ac enim. In tempor, turpis nec euismod scelerisque, quam turpis adipiscing lorem, vitae mattis nibh ligula nec sem.",Praesent id massa id nisl venenatis lacinia. Aenean sit amet justo. Morbi ut odio.,snorkeling,Polish,Irish Gaelic,Swahili,Tetum,http://dummyimage.com/181x123.png/dddddd/000000,http://dummyimage.com/292x229.png/cc0000/ffffff,http://dummyimage.com/201x200.png/ff4444/ffffff,http://dummyimage.com/225x220.png/5fa2dd/ffffff,,,2/17/2017
180,80,7,Monitored empowering open architecture,"Donec diam neque, vestibulum eget, vulputate ut, ultrices vel, augue. Vestibulum ante ipsum primis in faucibus orci luctus et ultrices posuere cubilia Curae; Donec pharetra, magna vestibulum aliquet ultrices, erat tortor sollicitudin mi, sit amet lobortis sapien sapien non mi. Integer ac neque.

Duis bibendum. Morbi non quam nec dui luctus rutrum. Nulla tellus.","Nulla ac enim. In tempor, turpis nec euismod scelerisque, quam turpis adipiscing lorem, vitae mattis nibh ligula nec sem. Duis aliquam convallis nunc.",dogs,Assamese,Lao,Kazakh,Persian,http://dummyimage.com/119x120.png/cc0000/ffffff,http://dummyimage.com/238x223.png/dddddd/000000,,,,,3/23/2017
181,81,7,Horizontal context-sensitive superstructure,Integer tincidunt ante vel ipsum. Praesent blandit lacinia erat. Vestibulum sed magna at nunc commodo placerat.,Suspendisse potenti. Nullam porttitor lacus at turpis. Donec posuere metus vitae ipsum.,21 and over,Northern Sotho,Hebrew,Swedish,Danish,http://dummyimage.com/158x107.bmp/5fa2dd/ffffff,http://dummyimage.com/210x224.bmp/cc0000/ffffff,http://dummyimage.com/235x188.bmp/cc0000/ffffff,,http://dummyimage.com/163x117.jpg/5fa2dd/ffffff,,11/24/2016
182,82,10,Upgradable demand-driven application,Duis consequat dui nec nisi volutpat eleifend. Donec ut dolor. Morbi vel lectus in quam fringilla rhoncus.,"Vivamus vestibulum sagittis sapien. Cum sociis natoque penatibus et magnis dis parturient montes, nascetur ridiculus mus. Etiam vel augue.",monk seal,Lithuanian,Tetum,Ndebele,Hebrew,http://dummyimage.com/103x143.jpg/5fa2dd/ffffff,http://dummyimage.com/266x282.jpg/ff4444/ffffff,,,http://dummyimage.com/160x197.jpg/dddddd/000000,http://dummyimage.com/116x238.png/dddddd/000000,9/27/2016
183,83,16,Face to face full-range system engine,Duis bibendum. Morbi non quam nec dui luctus rutrum. Nulla tellus.,Praesent blandit.,dogs,Filipino,Māori,Tamil,Tajik,http://dummyimage.com/206x171.jpg/5fa2dd/ffffff,http://dummyimage.com/280x281.bmp/dddddd/000000,,http://dummyimage.com/221x208.bmp/ff4444/ffffff,,http://dummyimage.com/220x175.bmp/ff4444/ffffff,8/6/2016
184,84,3,Organized foreground monitoring,In congue. Etiam justo. Etiam pretium iaculis justo.,"Donec quis orci eget orci vehicula condimentum. Curabitur in libero ut massa volutpat convallis. Morbi odio odio, elementum eu, interdum eu, tincidunt in, leo.",luau,Tswana,Dhivehi,New Zealand Sign Language,New Zealand Sign Language,http://dummyimage.com/199x206.jpg/ff4444/ffffff,http://dummyimage.com/267x300.jpg/ff4444/ffffff,,,http://dummyimage.com/239x113.png/dddddd/000000,,1/25/2017
185,85,25,Organic demand-driven portal,"Nam ultrices, libero non mattis pulvinar, nulla pede ullamcorper augue, a suscipit nulla elit ac nulla. Sed vel enim sit amet nunc viverra dapibus. Nulla suscipit ligula in lacus.

Curabitur at ipsum ac tellus semper interdum. Mauris ullamcorper purus sit amet nulla. Quisque arcu libero, rutrum ac, lobortis vel, dapibus at, diam.",Vivamus in felis eu sapien cursus vestibulum. Proin eu mi. Nulla ac enim.,hawaiian,Italian,Swahili,Zulu,Somali,http://dummyimage.com/166x232.jpg/cc0000/ffffff,http://dummyimage.com/248x291.png/cc0000/ffffff,http://dummyimage.com/229x182.bmp/ff4444/ffffff,http://dummyimage.com/223x203.bmp/cc0000/ffffff,,,5/12/2016
186,86,23,Organic human-resource synergy,"Proin interdum mauris non ligula pellentesque ultrices. Phasellus id sapien in sapien iaculis congue. Vivamus metus arcu, adipiscing molestie, hendrerit at, vulputate vitae, nisl.

Aenean lectus. Pellentesque eget nunc. Donec quis orci eget orci vehicula condimentum.",Maecenas pulvinar lobortis est. Phasellus sit amet erat.,walking,Hindi,Georgian,Tajik,Nepali,http://dummyimage.com/245x152.png/5fa2dd/ffffff,http://dummyimage.com/290x213.bmp/dddddd/000000,,,,,5/24/2016
