id,fk_provider_id,fk_type_id,slogan,description,short_description,keywords,language_spoken1,language_spoken2,language_spoken3,language_spoken4,image_path_1,image_path_2,image_path_3,image_path_4,video_image_1,video_image_2,reg_date
1,1,20,Devolved optimal process improvement,"Fusce posuere felis sed lacus. Morbi sem mauris, laoreet ut, rhoncus aliquet, pulvinar sed, nisl. Nunc rhoncus dui vel sem.","Duis bibendum, felis sed interdum venenatis, turpis enim blandit mi, in porttitor pede justo eu massa. Donec dapibus.",tour,Montenegrin,Romanian,Malayalam,Kashmiri,http://dummyimage.com/101x135.jpg/5fa2dd/ffffff,http://dummyimage.com/205x252.png/cc0000/ffffff,,,,http://dummyimage.com/179x154.jpg/5fa2dd/ffffff,7/21/2016
2,2,15,Synergistic intermediate productivity,Duis consequat dui nec nisi volutpat eleifend. Donec ut dolor. Morbi vel lectus in quam fringilla rhoncus.,Aliquam non mauris. Morbi non lectus. Aliquam sit amet diam in magna bibendum imperdiet.,hiking,Kazakh,Montenegrin,Finnish,Dari,http://dummyimage.com/164x127.jpg/dddddd/000000,http://dummyimage.com/213x249.jpg/cc0000/ffffff,http://dummyimage.com/228x243.png/ff4444/ffffff,,http://dummyimage.com/234x223.png/ff4444/ffffff,,2/6/2017
3,3,28,Digitized asymmetric definition,"Quisque id justo sit amet sapien dignissim vestibulum. Vestibulum ante ipsum primis in faucibus orci luctus et ultrices posuere cubilia Curae; Nulla dapibus dolor vel est. Donec odio justo, sollicitudin ut, suscipit a, feugiat et, eros.

Vestibulum ac est lacinia nisi venenatis tristique. Fusce congue, diam id ornare imperdiet, sapien urna pretium nisl, ut volutpat sapien arcu sed augue. Aliquam erat volutpat.",Curabitur gravida nisi at nibh. In hac habitasse platea dictumst.,snorkeling,Sotho,Croatian,Hiri Motu,Nepali,http://dummyimage.com/228x229.bmp/cc0000/ffffff,http://dummyimage.com/270x200.bmp/dddddd/000000,,http://dummyimage.com/239x203.png/dddddd/000000,http://dummyimage.com/197x228.png/ff4444/ffffff,http://dummyimage.com/175x130.png/cc0000/ffffff,12/13/2016
4,4,20,Optimized human-resource system engine,"Curabitur in libero ut massa volutpat convallis. Morbi odio odio, elementum eu, interdum eu, tincidunt in, leo. Maecenas pulvinar lobortis est.",Suspendisse accumsan tortor quis turpis. Sed ante.,restaurant,Afrikaans,Somali,Armenian,Khmer,http://dummyimage.com/205x194.jpg/5fa2dd/ffffff,http://dummyimage.com/220x240.png/5fa2dd/ffffff,,,http://dummyimage.com/185x108.jpg/dddddd/000000,,4/16/2017
5,5,27,Assimilated exuding leverage,Suspendisse potenti. In eleifend quam a odio. In hac habitasse platea dictumst.,Duis mattis egestas metus.,biking,Guaraní,Hebrew,Fijian,Dzongkha,http://dummyimage.com/186x176.png/5fa2dd/ffffff,http://dummyimage.com/296x294.png/5fa2dd/ffffff,http://dummyimage.com/170x195.jpg/dddddd/000000,,http://dummyimage.com/191x155.bmp/cc0000/ffffff,,6/22/2016
6,6,19,Object-based dynamic data-warehouse,"Duis aliquam convallis nunc. Proin at turpis a pede posuere nonummy. Integer non velit.

Donec diam neque, vestibulum eget, vulputate ut, ultrices vel, augue. Vestibulum ante ipsum primis in faucibus orci luctus et ultrices posuere cubilia Curae; Donec pharetra, magna vestibulum aliquet ultrices, erat tortor sollicitudin mi, sit amet lobortis sapien sapien non mi. Integer ac neque.",Vestibulum ante ipsum primis in faucibus orci luctus et ultrices posuere cubilia Curae; Duis faucibus accumsan odio.,hawaiian,Papiamento,Irish Gaelic,Maltese,Czech,http://dummyimage.com/234x120.jpg/cc0000/ffffff,http://dummyimage.com/288x280.png/ff4444/ffffff,,,,,10/11/2016
7,7,27,Upgradable human-resource pricing structure,"Quisque id justo sit amet sapien dignissim vestibulum. Vestibulum ante ipsum primis in faucibus orci luctus et ultrices posuere cubilia Curae; Nulla dapibus dolor vel est. Donec odio justo, sollicitudin ut, suscipit a, feugiat et, eros.

Vestibulum ac est lacinia nisi venenatis tristique. Fusce congue, diam id ornare imperdiet, sapien urna pretium nisl, ut volutpat sapien arcu sed augue. Aliquam erat volutpat.",Aliquam quis turpis eget elit sodales scelerisque.,eating,Amharic,Kannada,Haitian Creole,Korean,http://dummyimage.com/227x214.jpg/cc0000/ffffff,http://dummyimage.com/209x281.png/dddddd/000000,http://dummyimage.com/225x180.png/cc0000/ffffff,,http://dummyimage.com/174x186.jpg/cc0000/ffffff,,12/29/2016
8,8,10,Robust directional time-frame,"Curabitur gravida nisi at nibh. In hac habitasse platea dictumst. Aliquam augue quam, sollicitudin vitae, consectetuer eget, rutrum at, lorem.

Integer tincidunt ante vel ipsum. Praesent blandit lacinia erat. Vestibulum sed magna at nunc commodo placerat.",Morbi quis tortor id nulla ultrices aliquet.,biking,Chinese,Zulu,Polish,Malagasy,http://dummyimage.com/219x221.jpg/cc0000/ffffff,,http://dummyimage.com/215x158.jpg/5fa2dd/ffffff,http://dummyimage.com/247x213.png/cc0000/ffffff,,,5/1/2016
9,9,29,Pre-emptive encompassing complexity,"Mauris enim leo, rhoncus sed, vestibulum sit amet, cursus id, turpis. Integer aliquet, massa id lobortis convallis, tortor risus dapibus augue, vel accumsan tellus nisi eu orci. Mauris lacinia sapien quis libero.

Nullam sit amet turpis elementum ligula vehicula consequat. Morbi a ipsum. Integer a nibh.",Vestibulum sed magna at nunc commodo placerat. Praesent blandit. Nam nulla.,nature,English,Tsonga,Persian,Pashto,http://dummyimage.com/134x191.bmp/5fa2dd/ffffff,http://dummyimage.com/289x252.bmp/5fa2dd/ffffff,http://dummyimage.com/182x233.bmp/cc0000/ffffff,http://dummyimage.com/214x222.jpg/ff4444/ffffff,,http://dummyimage.com/119x144.png/5fa2dd/ffffff,12/24/2016
10,10,13,Customer-focused client-driven data-warehouse,"Fusce posuere felis sed lacus. Morbi sem mauris, laoreet ut, rhoncus aliquet, pulvinar sed, nisl. Nunc rhoncus dui vel sem.",Duis aliquam convallis nunc. Proin at turpis a pede posuere nonummy. Integer non velit.,monk seal,Gagauz,Ndebele,English,Japanese,http://dummyimage.com/201x226.bmp/ff4444/ffffff,http://dummyimage.com/226x216.jpg/ff4444/ffffff,http://dummyimage.com/166x176.png/ff4444/ffffff,,http://dummyimage.com/136x127.jpg/cc0000/ffffff,,4/2/2017
11,11,8,Quality-focused explicit open system,Aenean lectus. Pellentesque eget nunc. Donec quis orci eget orci vehicula condimentum.,Integer tincidunt ante vel ipsum. Praesent blandit lacinia erat.,hawaiian,Burmese,Italian,Dari,Lithuanian,http://dummyimage.com/203x176.jpg/ff4444/ffffff,http://dummyimage.com/272x256.bmp/cc0000/ffffff,,,http://dummyimage.com/225x125.bmp/5fa2dd/ffffff,,8/15/2016
12,12,28,Inverse context-sensitive software,"Maecenas tristique, est et tempus semper, est quam pharetra magna, ac consequat metus sapien ut nunc. Vestibulum ante ipsum primis in faucibus orci luctus et ultrices posuere cubilia Curae; Mauris viverra diam vitae quam. Suspendisse potenti.",Aliquam sit amet diam in magna bibendum imperdiet.,drinks,Kannada,Dhivehi,Icelandic,Assamese,http://dummyimage.com/165x153.jpg/5fa2dd/ffffff,http://dummyimage.com/267x278.jpg/ff4444/ffffff,http://dummyimage.com/219x181.png/ff4444/ffffff,,,,8/14/2016
13,13,22,Synergistic systemic adapter,Pellentesque at nulla. Suspendisse potenti. Cras in purus eu magna vulputate luctus.,"Integer pede justo, lacinia eget, tincidunt eget, tempus vel, pede. Morbi porttitor lorem id ligula.",tour,Georgian,Assamese,Tsonga,Moldovan,http://dummyimage.com/136x154.bmp/ff4444/ffffff,http://dummyimage.com/284x297.bmp/ff4444/ffffff,http://dummyimage.com/183x239.jpg/dddddd/000000,,http://dummyimage.com/132x238.bmp/dddddd/000000,,9/12/2016
14,14,27,Enterprise-wide cohesive capacity,"Curabitur gravida nisi at nibh. In hac habitasse platea dictumst. Aliquam augue quam, sollicitudin vitae, consectetuer eget, rutrum at, lorem.",Morbi a ipsum.,art,Ndebele,Bislama,Lithuanian,Albanian,http://dummyimage.com/246x165.jpg/5fa2dd/ffffff,http://dummyimage.com/214x217.png/dddddd/000000,http://dummyimage.com/191x163.bmp/dddddd/000000,http://dummyimage.com/249x207.png/ff4444/ffffff,http://dummyimage.com/148x102.png/cc0000/ffffff,http://dummyimage.com/185x215.bmp/dddddd/000000,6/23/2016
15,15,4,Organized 6th generation productivity,"In sagittis dui vel nisl. Duis ac nibh. Fusce lacus purus, aliquet at, feugiat non, pretium quis, lectus.

Suspendisse potenti. In eleifend quam a odio. In hac habitasse platea dictumst.",Donec semper sapien a libero. Nam dui.,surfing,Thai,Belarusian,Arabic,Bengali,http://dummyimage.com/199x195.jpg/5fa2dd/ffffff,http://dummyimage.com/238x248.jpg/cc0000/ffffff,http://dummyimage.com/155x155.bmp/dddddd/000000,,,,8/6/2016
16,16,20,Virtual contextually-based structure,"Maecenas leo odio, condimentum id, luctus nec, molestie sed, justo. Pellentesque viverra pede ac diam. Cras pellentesque volutpat dui.",Nullam varius.,surfing,Hungarian,Swahili,Indonesian,Polish,http://dummyimage.com/150x166.jpg/ff4444/ffffff,http://dummyimage.com/213x218.png/ff4444/ffffff,,http://dummyimage.com/215x209.jpg/dddddd/000000,,,10/6/2016
17,17,27,Cross-group fault-tolerant methodology,"Curabitur gravida nisi at nibh. In hac habitasse platea dictumst. Aliquam augue quam, sollicitudin vitae, consectetuer eget, rutrum at, lorem.",Vestibulum ante ipsum primis in faucibus orci luctus et ultrices posuere cubilia Curae; Duis faucibus accumsan odio.,snorkeling,Persian,Italian,Quechua,Kannada,http://dummyimage.com/178x130.jpg/cc0000/ffffff,,,,,,9/22/2016
18,18,12,Reverse-engineered cohesive success,In congue. Etiam justo. Etiam pretium iaculis justo.,Maecenas pulvinar lobortis est. Phasellus sit amet erat.,restaurant,Assamese,English,Gujarati,Northern Sotho,http://dummyimage.com/199x143.png/dddddd/000000,http://dummyimage.com/216x206.png/dddddd/000000,,http://dummyimage.com/246x231.jpg/5fa2dd/ffffff,http://dummyimage.com/165x240.jpg/dddddd/000000,,10/15/2016
19,19,6,Inverse asynchronous moratorium,"Duis consequat dui nec nisi volutpat eleifend. Donec ut dolor. Morbi vel lectus in quam fringilla rhoncus.

Mauris enim leo, rhoncus sed, vestibulum sit amet, cursus id, turpis. Integer aliquet, massa id lobortis convallis, tortor risus dapibus augue, vel accumsan tellus nisi eu orci. Mauris lacinia sapien quis libero.","Fusce lacus purus, aliquet at, feugiat non, pretium quis, lectus.",hiking,Arabic,Marathi,Bengali,Latvian,http://dummyimage.com/134x238.png/cc0000/ffffff,,http://dummyimage.com/184x174.png/5fa2dd/ffffff,,http://dummyimage.com/112x160.png/cc0000/ffffff,,9/21/2016
20,20,25,Upgradable interactive internet solution,"Curabitur in libero ut massa volutpat convallis. Morbi odio odio, elementum eu, interdum eu, tincidunt in, leo. Maecenas pulvinar lobortis est.

Phasellus sit amet erat. Nulla tempus. Vivamus in felis eu sapien cursus vestibulum.",Vestibulum ante ipsum primis in faucibus orci luctus et ultrices posuere cubilia Curae; Duis faucibus accumsan odio. Curabitur convallis.,instagram,Bosnian,Māori,Persian,Moldovan,http://dummyimage.com/116x217.png/ff4444/ffffff,http://dummyimage.com/269x223.bmp/cc0000/ffffff,,http://dummyimage.com/229x236.bmp/5fa2dd/ffffff,http://dummyimage.com/153x188.png/ff4444/ffffff,,6/23/2016
21,21,24,Monitored optimizing hub,"Mauris enim leo, rhoncus sed, vestibulum sit amet, cursus id, turpis. Integer aliquet, massa id lobortis convallis, tortor risus dapibus augue, vel accumsan tellus nisi eu orci. Mauris lacinia sapien quis libero.",Morbi porttitor lorem id ligula. Suspendisse ornare consequat lectus.,food,Malay,Italian,Irish Gaelic,Oriya,http://dummyimage.com/238x132.jpg/cc0000/ffffff,http://dummyimage.com/216x274.bmp/5fa2dd/ffffff,http://dummyimage.com/231x177.png/cc0000/ffffff,http://dummyimage.com/207x214.png/ff4444/ffffff,http://dummyimage.com/236x132.png/cc0000/ffffff,http://dummyimage.com/113x127.jpg/dddddd/000000,11/28/2016
22,22,30,Monitored zero administration encoding,"Lorem ipsum dolor sit amet, consectetuer adipiscing elit. Proin risus. Praesent lectus.",Vivamus tortor. Duis mattis egestas metus. Aenean fermentum.,food,Guaraní,Marathi,Malagasy,Azeri,http://dummyimage.com/179x112.bmp/ff4444/ffffff,http://dummyimage.com/225x231.jpg/dddddd/000000,http://dummyimage.com/248x178.jpg/ff4444/ffffff,http://dummyimage.com/249x223.bmp/dddddd/000000,,http://dummyimage.com/133x180.png/cc0000/ffffff,11/14/2016
23,23,1,User-friendly mission-critical database,"Phasellus in felis. Donec semper sapien a libero. Nam dui.

Proin leo odio, porttitor id, consequat in, consequat ut, nulla. Sed accumsan felis. Ut at dolor quis odio consequat varius.","Vestibulum ante ipsum primis in faucibus orci luctus et ultrices posuere cubilia Curae; Donec pharetra, magna vestibulum aliquet ultrices, erat tortor sollicitudin mi, sit amet lobortis sapien sapien non mi. Integer ac neque.",cooking,Marathi,Portuguese,Gagauz,Irish Gaelic,http://dummyimage.com/121x115.jpg/ff4444/ffffff,http://dummyimage.com/235x287.jpg/5fa2dd/ffffff,http://dummyimage.com/231x212.bmp/5fa2dd/ffffff,,http://dummyimage.com/155x132.jpg/cc0000/ffffff,,11/3/2016
24,24,11,Re-engineered mobile ability,Phasellus in felis. Donec semper sapien a libero. Nam dui.,"Curabitur in libero ut massa volutpat convallis. Morbi odio odio, elementum eu, interdum eu, tincidunt in, leo.",walking,Chinese,Icelandic,Icelandic,Macedonian,http://dummyimage.com/210x151.jpg/cc0000/ffffff,http://dummyimage.com/275x248.png/dddddd/000000,http://dummyimage.com/168x237.png/dddddd/000000,,http://dummyimage.com/141x159.png/ff4444/ffffff,,9/29/2016
25,25,20,Intuitive attitude-oriented software,"In hac habitasse platea dictumst. Etiam faucibus cursus urna. Ut tellus.

Nulla ut erat id mauris vulputate elementum. Nullam varius. Nulla facilisi.","Sed sagittis. Nam congue, risus semper porta volutpat, quam pede lobortis ligula, sit amet eleifend pede libero quis orci.",surfing,Amharic,Hebrew,Ndebele,Kazakh,http://dummyimage.com/137x248.bmp/cc0000/ffffff,http://dummyimage.com/238x200.bmp/dddddd/000000,,http://dummyimage.com/227x208.png/5fa2dd/ffffff,http://dummyimage.com/154x238.bmp/ff4444/ffffff,,2/4/2017
26,26,16,Function-based user-facing productivity,"Sed sagittis. Nam congue, risus semper porta volutpat, quam pede lobortis ligula, sit amet eleifend pede libero quis orci. Nullam molestie nibh in lectus.

Pellentesque at nulla. Suspendisse potenti. Cras in purus eu magna vulputate luctus.",Proin interdum mauris non ligula pellentesque ultrices.,hawaiian,Assamese,New Zealand Sign Language,Somali,Czech,http://dummyimage.com/107x180.jpg/5fa2dd/ffffff,http://dummyimage.com/256x265.bmp/cc0000/ffffff,http://dummyimage.com/212x223.jpg/5fa2dd/ffffff,http://dummyimage.com/232x249.png/ff4444/ffffff,http://dummyimage.com/211x141.jpg/dddddd/000000,,8/24/2016
27,27,14,Multi-tiered optimal matrices,Integer ac leo. Pellentesque ultrices mattis odio. Donec vitae nisi.,Aenean lectus.,surfing,Tamil,Hebrew,Kurdish,Bengali,http://dummyimage.com/181x128.bmp/dddddd/000000,http://dummyimage.com/243x269.png/dddddd/000000,http://dummyimage.com/189x222.bmp/5fa2dd/ffffff,http://dummyimage.com/239x223.png/5fa2dd/ffffff,,,2/9/2017
28,28,25,Profit-focused incremental knowledge base,Nullam porttitor lacus at turpis. Donec posuere metus vitae ipsum. Aliquam non mauris.,Sed accumsan felis.,walking,Bengali,Guaraní,Somali,Tamil,http://dummyimage.com/209x238.png/ff4444/ffffff,http://dummyimage.com/259x252.bmp/cc0000/ffffff,http://dummyimage.com/190x216.png/dddddd/000000,http://dummyimage.com/248x220.bmp/dddddd/000000,,,6/4/2016
29,29,1,Cloned uniform paradigm,Nulla ut erat id mauris vulputate elementum. Nullam varius. Nulla facilisi.,"Duis ac nibh. Fusce lacus purus, aliquet at, feugiat non, pretium quis, lectus.",snorkeling,Irish Gaelic,Haitian Creole,New Zealand Sign Language,Tswana,http://dummyimage.com/227x220.png/cc0000/ffffff,,http://dummyimage.com/222x250.bmp/dddddd/000000,http://dummyimage.com/247x205.png/dddddd/000000,http://dummyimage.com/228x131.jpg/cc0000/ffffff,,8/14/2016
30,30,13,Face to face bottom-line approach,"In sagittis dui vel nisl. Duis ac nibh. Fusce lacus purus, aliquet at, feugiat non, pretium quis, lectus.",Integer a nibh. In quis justo. Maecenas rhoncus aliquam lacus.,tour,Northern Sotho,Pashto,Portuguese,Bosnian,http://dummyimage.com/238x142.png/5fa2dd/ffffff,http://dummyimage.com/213x227.bmp/5fa2dd/ffffff,http://dummyimage.com/240x219.jpg/dddddd/000000,http://dummyimage.com/240x200.jpg/cc0000/ffffff,http://dummyimage.com/213x192.jpg/cc0000/ffffff,http://dummyimage.com/207x186.png/dddddd/000000,1/7/2017
31,31,7,Fundamental responsive hardware,"Lorem ipsum dolor sit amet, consectetuer adipiscing elit. Proin risus. Praesent lectus.

Vestibulum quam sapien, varius ut, blandit non, interdum in, ante. Vestibulum ante ipsum primis in faucibus orci luctus et ultrices posuere cubilia Curae; Duis faucibus accumsan odio. Curabitur convallis.",Ut tellus.,drinks,Tsonga,Italian,Czech,Assamese,http://dummyimage.com/193x232.jpg/cc0000/ffffff,http://dummyimage.com/258x280.png/dddddd/000000,http://dummyimage.com/215x250.jpg/dddddd/000000,,,,11/4/2016
32,32,15,Inverse full-range leverage,"Morbi non lectus. Aliquam sit amet diam in magna bibendum imperdiet. Nullam orci pede, venenatis non, sodales sed, tincidunt eu, felis.",Duis bibendum. Morbi non quam nec dui luctus rutrum. Nulla tellus.,drinks,Mongolian,Somali,Aymara,Nepali,http://dummyimage.com/157x114.png/5fa2dd/ffffff,http://dummyimage.com/284x230.png/5fa2dd/ffffff,http://dummyimage.com/184x183.jpg/cc0000/ffffff,http://dummyimage.com/243x202.png/5fa2dd/ffffff,,,4/5/2017
33,33,20,Balanced cohesive knowledge base,"Donec diam neque, vestibulum eget, vulputate ut, ultrices vel, augue. Vestibulum ante ipsum primis in faucibus orci luctus et ultrices posuere cubilia Curae; Donec pharetra, magna vestibulum aliquet ultrices, erat tortor sollicitudin mi, sit amet lobortis sapien sapien non mi. Integer ac neque.

Duis bibendum. Morbi non quam nec dui luctus rutrum. Nulla tellus.",Proin at turpis a pede posuere nonummy.,biking,New Zealand Sign Language,Guaraní,Portuguese,Gujarati,http://dummyimage.com/238x106.png/5fa2dd/ffffff,,http://dummyimage.com/182x211.jpg/ff4444/ffffff,,http://dummyimage.com/220x198.bmp/cc0000/ffffff,,7/1/2016
34,34,1,Multi-channelled zero defect circuit,"Proin leo odio, porttitor id, consequat in, consequat ut, nulla. Sed accumsan felis. Ut at dolor quis odio consequat varius.

Integer ac leo. Pellentesque ultrices mattis odio. Donec vitae nisi.",Nulla tellus. In sagittis dui vel nisl. Duis ac nibh.,restaurant,Lao,Hiri Motu,Aymara,Dzongkha,http://dummyimage.com/101x215.jpg/5fa2dd/ffffff,,http://dummyimage.com/157x214.bmp/5fa2dd/ffffff,,http://dummyimage.com/182x172.jpg/dddddd/000000,,9/23/2016
35,35,7,Front-line optimizing array,Phasellus sit amet erat. Nulla tempus. Vivamus in felis eu sapien cursus vestibulum.,"Fusce lacus purus, aliquet at, feugiat non, pretium quis, lectus. Suspendisse potenti.",restaurant,Danish,Thai,Catalan,Chinese,http://dummyimage.com/121x107.bmp/5fa2dd/ffffff,http://dummyimage.com/245x222.jpg/5fa2dd/ffffff,http://dummyimage.com/225x190.bmp/cc0000/ffffff,,,http://dummyimage.com/209x237.bmp/ff4444/ffffff,7/19/2016
36,36,21,Multi-layered full-range attitude,"Vestibulum ac est lacinia nisi venenatis tristique. Fusce congue, diam id ornare imperdiet, sapien urna pretium nisl, ut volutpat sapien arcu sed augue. Aliquam erat volutpat.

In congue. Etiam justo. Etiam pretium iaculis justo.",Etiam faucibus cursus urna. Ut tellus.,nature,Khmer,Dutch,Dhivehi,Bosnian,http://dummyimage.com/238x227.jpg/5fa2dd/ffffff,http://dummyimage.com/253x246.bmp/dddddd/000000,,http://dummyimage.com/218x212.png/5fa2dd/ffffff,http://dummyimage.com/199x180.png/cc0000/ffffff,,9/23/2016
37,37,2,Balanced system-worthy initiative,"Praesent blandit. Nam nulla. Integer pede justo, lacinia eget, tincidunt eget, tempus vel, pede.

Morbi porttitor lorem id ligula. Suspendisse ornare consequat lectus. In est risus, auctor sed, tristique in, tempus sit amet, sem.","Morbi odio odio, elementum eu, interdum eu, tincidunt in, leo. Maecenas pulvinar lobortis est.",snorkeling,Danish,Khmer,Tok Pisin,Portuguese,http://dummyimage.com/156x192.jpg/ff4444/ffffff,http://dummyimage.com/213x201.bmp/dddddd/000000,,http://dummyimage.com/242x228.jpg/5fa2dd/ffffff,,,6/30/2016
38,38,6,Reactive content-based local area network,"Duis bibendum, felis sed interdum venenatis, turpis enim blandit mi, in porttitor pede justo eu massa. Donec dapibus. Duis at velit eu est congue elementum.

In hac habitasse platea dictumst. Morbi vestibulum, velit id pretium iaculis, diam erat fermentum justo, nec condimentum neque sapien placerat ante. Nulla justo.",Vestibulum ante ipsum primis in faucibus orci luctus et ultrices posuere cubilia Curae; Mauris viverra diam vitae quam. Suspendisse potenti.,monk seal,Hindi,Pashto,New Zealand Sign Language,Gujarati,http://dummyimage.com/108x206.png/5fa2dd/ffffff,http://dummyimage.com/265x246.bmp/5fa2dd/ffffff,http://dummyimage.com/191x167.bmp/5fa2dd/ffffff,,,,9/13/2016
39,39,26,Total logistical superstructure,Maecenas ut massa quis augue luctus tincidunt. Nulla mollis molestie lorem. Quisque ut erat.,Donec ut mauris eget massa tempor convallis.,21 and over,Lithuanian,Albanian,Gujarati,Kazakh,http://dummyimage.com/211x228.bmp/cc0000/ffffff,http://dummyimage.com/234x283.jpg/dddddd/000000,http://dummyimage.com/166x185.bmp/dddddd/000000,http://dummyimage.com/238x235.png/dddddd/000000,http://dummyimage.com/144x106.bmp/5fa2dd/ffffff,,6/26/2016
40,40,6,Devolved content-based groupware,In quis justo. Maecenas rhoncus aliquam lacus. Morbi quis tortor id nulla ultrices aliquet.,"Fusce posuere felis sed lacus. Morbi sem mauris, laoreet ut, rhoncus aliquet, pulvinar sed, nisl.",luau,Dari,Nepali,Arabic,Azeri,http://dummyimage.com/167x140.bmp/dddddd/000000,,,http://dummyimage.com/213x205.bmp/cc0000/ffffff,http://dummyimage.com/123x134.png/ff4444/ffffff,,8/2/2016
41,41,25,Versatile demand-driven matrices,"Quisque porta volutpat erat. Quisque erat eros, viverra eget, congue eget, semper rutrum, nulla. Nunc purus.

Phasellus in felis. Donec semper sapien a libero. Nam dui.","Mauris enim leo, rhoncus sed, vestibulum sit amet, cursus id, turpis.",hawaiian,English,Persian,Dutch,Croatian,http://dummyimage.com/189x202.bmp/ff4444/ffffff,http://dummyimage.com/212x294.png/dddddd/000000,,http://dummyimage.com/237x209.bmp/cc0000/ffffff,,,6/24/2016
42,42,29,Assimilated radical Graphic Interface,"Pellentesque at nulla. Suspendisse potenti. Cras in purus eu magna vulputate luctus.

Cum sociis natoque penatibus et magnis dis parturient montes, nascetur ridiculus mus. Vivamus vestibulum sagittis sapien. Cum sociis natoque penatibus et magnis dis parturient montes, nascetur ridiculus mus.",Suspendisse potenti.,monk seal,Tswana,Marathi,Finnish,Kannada,http://dummyimage.com/187x146.bmp/cc0000/ffffff,http://dummyimage.com/214x243.png/ff4444/ffffff,,http://dummyimage.com/223x244.jpg/cc0000/ffffff,http://dummyimage.com/104x219.bmp/dddddd/000000,,5/4/2016
43,43,16,Adaptive dedicated hub,"In hac habitasse platea dictumst. Morbi vestibulum, velit id pretium iaculis, diam erat fermentum justo, nec condimentum neque sapien placerat ante. Nulla justo.

Aliquam quis turpis eget elit sodales scelerisque. Mauris sit amet eros. Suspendisse accumsan tortor quis turpis.",In blandit ultrices enim.,luau,Portuguese,Assamese,Norwegian,Bengali,http://dummyimage.com/209x229.bmp/dddddd/000000,,http://dummyimage.com/169x182.jpg/dddddd/000000,http://dummyimage.com/241x242.jpg/cc0000/ffffff,http://dummyimage.com/208x161.png/ff4444/ffffff,,11/20/2016
44,44,24,Decentralized regional instruction set,"Fusce consequat. Nulla nisl. Nunc nisl.

Duis bibendum, felis sed interdum venenatis, turpis enim blandit mi, in porttitor pede justo eu massa. Donec dapibus. Duis at velit eu est congue elementum.","Integer pede justo, lacinia eget, tincidunt eget, tempus vel, pede. Morbi porttitor lorem id ligula.",no kids,Pashto,Norwegian,Armenian,Catalan,http://dummyimage.com/249x151.bmp/ff4444/ffffff,http://dummyimage.com/294x285.png/ff4444/ffffff,http://dummyimage.com/211x222.bmp/5fa2dd/ffffff,http://dummyimage.com/245x229.bmp/5fa2dd/ffffff,,,10/9/2016
45,45,18,Multi-tiered eco-centric projection,Phasellus in felis. Donec semper sapien a libero. Nam dui.,Nullam porttitor lacus at turpis. Donec posuere metus vitae ipsum. Aliquam non mauris.,drinks,Chinese,Romanian,Pashto,Hungarian,http://dummyimage.com/171x147.png/5fa2dd/ffffff,http://dummyimage.com/224x281.png/5fa2dd/ffffff,http://dummyimage.com/250x205.jpg/ff4444/ffffff,,http://dummyimage.com/163x244.png/ff4444/ffffff,,4/11/2017
46,46,14,Re-engineered 24 hour approach,Maecenas ut massa quis augue luctus tincidunt. Nulla mollis molestie lorem. Quisque ut erat.,Ut at dolor quis odio consequat varius.,food,Norwegian,Finnish,Japanese,Swahili,http://dummyimage.com/177x244.bmp/ff4444/ffffff,,http://dummyimage.com/168x177.jpg/dddddd/000000,http://dummyimage.com/236x202.bmp/cc0000/ffffff,,,1/29/2017
47,47,18,Enhanced intangible structure,"Mauris enim leo, rhoncus sed, vestibulum sit amet, cursus id, turpis. Integer aliquet, massa id lobortis convallis, tortor risus dapibus augue, vel accumsan tellus nisi eu orci. Mauris lacinia sapien quis libero.

Nullam sit amet turpis elementum ligula vehicula consequat. Morbi a ipsum. Integer a nibh.",In quis justo. Maecenas rhoncus aliquam lacus. Morbi quis tortor id nulla ultrices aliquet.,hawaiian,Burmese,Estonian,Filipino,Oriya,http://dummyimage.com/156x145.png/cc0000/ffffff,http://dummyimage.com/269x231.jpg/dddddd/000000,,,,,2/4/2017
