id,fk_provider_id,fk_type_id,slogan,description,short_description,keywords,language_spoken1,language_spoken2,language_spoken3,language_spoken4,image_path_1,image_path_2,image_path_3,image_path_4,video_image_1,video_image_2,reg_date
48,48,17,Triple-buffered discrete open architecture,"Mauris enim leo, rhoncus sed, vestibulum sit amet, cursus id, turpis. Integer aliquet, massa id lobortis convallis, tortor risus dapibus augue, vel accumsan tellus nisi eu orci. Mauris lacinia sapien quis libero.",Duis bibendum. Morbi non quam nec dui luctus rutrum.,luau,Hungarian,Bengali,Tajik,Dutch,http://dummyimage.com/237x162.png/cc0000/ffffff,http://dummyimage.com/299x274.png/ff4444/ffffff,http://dummyimage.com/183x173.jpg/cc0000/ffffff,http://dummyimage.com/245x238.png/cc0000/ffffff,http://dummyimage.com/205x122.jpg/cc0000/ffffff,,4/22/2016
49,49,27,Triple-buffered full-range emulation,"Phasellus in felis. Donec semper sapien a libero. Nam dui.

Proin leo odio, porttitor id, consequat in, consequat ut, nulla. Sed accumsan felis. Ut at dolor quis odio consequat varius.",Suspendisse potenti. Nullam porttitor lacus at turpis. Donec posuere metus vitae ipsum.,food,Polish,Nepali,Assamese,Georgian,http://dummyimage.com/235x134.jpg/5fa2dd/ffffff,http://dummyimage.com/256x284.jpg/5fa2dd/ffffff,http://dummyimage.com/221x211.bmp/ff4444/ffffff,http://dummyimage.com/219x226.bmp/cc0000/ffffff,http://dummyimage.com/183x142.jpg/dddddd/000000,http://dummyimage.com/118x151.bmp/dddddd/000000,11/27/2016
50,50,3,Down-sized user-facing instruction set,Pellentesque at nulla. Suspendisse potenti. Cras in purus eu magna vulputate luctus.,Maecenas tincidunt lacus at velit. Vivamus vel nulla eget eros elementum pellentesque. Quisque porta volutpat erat.,eating,Burmese,Filipino,Oriya,Maltese,http://dummyimage.com/160x214.jpg/dddddd/000000,,http://dummyimage.com/235x204.png/dddddd/000000,http://dummyimage.com/247x249.jpg/ff4444/ffffff,,http://dummyimage.com/195x106.jpg/5fa2dd/ffffff,3/31/2017
51,51,28,Upgradable value-added strategy,"Aenean lectus. Pellentesque eget nunc. Donec quis orci eget orci vehicula condimentum.

Curabitur in libero ut massa volutpat convallis. Morbi odio odio, elementum eu, interdum eu, tincidunt in, leo. Maecenas pulvinar lobortis est.","Nam congue, risus semper porta volutpat, quam pede lobortis ligula, sit amet eleifend pede libero quis orci.",instagram,Dhivehi,Dhivehi,Dhivehi,Spanish,http://dummyimage.com/106x177.jpg/dddddd/000000,,,http://dummyimage.com/214x217.png/cc0000/ffffff,,,9/17/2016
52,52,19,Assimilated mission-critical ability,"Nulla ut erat id mauris vulputate elementum. Nullam varius. Nulla facilisi.

Cras non velit nec nisi vulputate nonummy. Maecenas tincidunt lacus at velit. Vivamus vel nulla eget eros elementum pellentesque.","Lorem ipsum dolor sit amet, consectetuer adipiscing elit. Proin risus.",restaurant,Nepali,Persian,Macedonian,Sotho,http://dummyimage.com/232x102.png/dddddd/000000,http://dummyimage.com/240x279.bmp/dddddd/000000,http://dummyimage.com/214x201.bmp/cc0000/ffffff,http://dummyimage.com/225x201.bmp/5fa2dd/ffffff,http://dummyimage.com/236x217.png/cc0000/ffffff,http://dummyimage.com/186x107.bmp/ff4444/ffffff,11/2/2016
53,53,20,Re-engineered demand-driven standardization,In congue. Etiam justo. Etiam pretium iaculis justo.,"Donec odio justo, sollicitudin ut, suscipit a, feugiat et, eros. Vestibulum ac est lacinia nisi venenatis tristique. Fusce congue, diam id ornare imperdiet, sapien urna pretium nisl, ut volutpat sapien arcu sed augue.",luau,Haitian Creole,Norwegian,Tetum,Tok Pisin,http://dummyimage.com/142x207.png/5fa2dd/ffffff,http://dummyimage.com/221x244.bmp/ff4444/ffffff,http://dummyimage.com/237x225.png/dddddd/000000,,http://dummyimage.com/186x235.png/ff4444/ffffff,,9/21/2016
54,54,16,Multi-lateral modular moratorium,"Quisque id justo sit amet sapien dignissim vestibulum. Vestibulum ante ipsum primis in faucibus orci luctus et ultrices posuere cubilia Curae; Nulla dapibus dolor vel est. Donec odio justo, sollicitudin ut, suscipit a, feugiat et, eros.

Vestibulum ac est lacinia nisi venenatis tristique. Fusce congue, diam id ornare imperdiet, sapien urna pretium nisl, ut volutpat sapien arcu sed augue. Aliquam erat volutpat.",Vestibulum ante ipsum primis in faucibus orci luctus et ultrices posuere cubilia Curae; Mauris viverra diam vitae quam.,21 and over,Dutch,Hindi,Somali,Japanese,http://dummyimage.com/103x165.jpg/dddddd/000000,http://dummyimage.com/231x277.bmp/dddddd/000000,http://dummyimage.com/229x180.png/cc0000/ffffff,http://dummyimage.com/227x250.jpg/cc0000/ffffff,,,11/3/2016
55,55,29,Streamlined contextually-based support,"Cras mi pede, malesuada in, imperdiet et, commodo vulputate, justo. In blandit ultrices enim. Lorem ipsum dolor sit amet, consectetuer adipiscing elit.",In quis justo. Maecenas rhoncus aliquam lacus. Morbi quis tortor id nulla ultrices aliquet.,restaurant,Norwegian,Indonesian,Latvian,Persian,http://dummyimage.com/173x123.bmp/dddddd/000000,http://dummyimage.com/285x267.png/cc0000/ffffff,http://dummyimage.com/158x182.bmp/cc0000/ffffff,http://dummyimage.com/229x230.bmp/cc0000/ffffff,,,6/16/2016
56,56,10,Organic tertiary strategy,"Duis bibendum, felis sed interdum venenatis, turpis enim blandit mi, in porttitor pede justo eu massa. Donec dapibus. Duis at velit eu est congue elementum.",Praesent id massa id nisl venenatis lacinia. Aenean sit amet justo. Morbi ut odio.,walking,Spanish,Belarusian,Sotho,Tsonga,http://dummyimage.com/231x202.png/dddddd/000000,http://dummyimage.com/279x284.png/5fa2dd/ffffff,,http://dummyimage.com/220x205.jpg/5fa2dd/ffffff,,,5/18/2016
57,57,20,Face to face real-time encryption,"Cum sociis natoque penatibus et magnis dis parturient montes, nascetur ridiculus mus. Vivamus vestibulum sagittis sapien. Cum sociis natoque penatibus et magnis dis parturient montes, nascetur ridiculus mus.

Etiam vel augue. Vestibulum rutrum rutrum neque. Aenean auctor gravida sem.",Etiam pretium iaculis justo.,eating,Hebrew,German,Macedonian,Tswana,http://dummyimage.com/120x196.jpg/ff4444/ffffff,http://dummyimage.com/277x236.jpg/cc0000/ffffff,,http://dummyimage.com/218x202.png/ff4444/ffffff,,,10/14/2016
58,58,3,Self-enabling well-modulated implementation,"Aenean lectus. Pellentesque eget nunc. Donec quis orci eget orci vehicula condimentum.

Curabitur in libero ut massa volutpat convallis. Morbi odio odio, elementum eu, interdum eu, tincidunt in, leo. Maecenas pulvinar lobortis est.",Etiam faucibus cursus urna. Ut tellus.,walking,Khmer,Lao,Swati,Hebrew,http://dummyimage.com/131x133.bmp/cc0000/ffffff,http://dummyimage.com/294x270.png/dddddd/000000,http://dummyimage.com/199x214.png/ff4444/ffffff,http://dummyimage.com/235x216.jpg/ff4444/ffffff,,,9/16/2016
59,59,7,Distributed bi-directional architecture,"Fusce consequat. Nulla nisl. Nunc nisl.

Duis bibendum, felis sed interdum venenatis, turpis enim blandit mi, in porttitor pede justo eu massa. Donec dapibus. Duis at velit eu est congue elementum.",Suspendisse potenti. Nullam porttitor lacus at turpis. Donec posuere metus vitae ipsum.,monk seal,Swati,Afrikaans,Japanese,Fijian,http://dummyimage.com/212x110.jpg/dddddd/000000,http://dummyimage.com/258x209.jpg/ff4444/ffffff,http://dummyimage.com/192x157.bmp/ff4444/ffffff,,http://dummyimage.com/217x217.bmp/dddddd/000000,,9/5/2016
60,60,25,Programmable analyzing adapter,"In quis justo. Maecenas rhoncus aliquam lacus. Morbi quis tortor id nulla ultrices aliquet.

Maecenas leo odio, condimentum id, luctus nec, molestie sed, justo. Pellentesque viverra pede ac diam. Cras pellentesque volutpat dui.",Nulla ut erat id mauris vulputate elementum. Nullam varius.,snorkeling,Hiri Motu,Romanian,Maltese,Aymara,http://dummyimage.com/207x136.png/5fa2dd/ffffff,http://dummyimage.com/207x200.jpg/ff4444/ffffff,http://dummyimage.com/200x195.bmp/5fa2dd/ffffff,,,,12/1/2016
61,61,3,Devolved directional open architecture,"Nam ultrices, libero non mattis pulvinar, nulla pede ullamcorper augue, a suscipit nulla elit ac nulla. Sed vel enim sit amet nunc viverra dapibus. Nulla suscipit ligula in lacus.

Curabitur at ipsum ac tellus semper interdum. Mauris ullamcorper purus sit amet nulla. Quisque arcu libero, rutrum ac, lobortis vel, dapibus at, diam.",Suspendisse accumsan tortor quis turpis. Sed ante.,surfing,Belarusian,German,Hindi,Polish,http://dummyimage.com/169x213.bmp/cc0000/ffffff,http://dummyimage.com/224x235.png/dddddd/000000,http://dummyimage.com/154x220.bmp/cc0000/ffffff,http://dummyimage.com/231x217.bmp/ff4444/ffffff,http://dummyimage.com/193x101.jpg/5fa2dd/ffffff,,2/3/2017
62,62,27,Vision-oriented systemic service-desk,"Aenean fermentum. Donec ut mauris eget massa tempor convallis. Nulla neque libero, convallis eget, eleifend luctus, ultricies eu, nibh.

Quisque id justo sit amet sapien dignissim vestibulum. Vestibulum ante ipsum primis in faucibus orci luctus et ultrices posuere cubilia Curae; Nulla dapibus dolor vel est. Donec odio justo, sollicitudin ut, suscipit a, feugiat et, eros.","Nullam orci pede, venenatis non, sodales sed, tincidunt eu, felis. Fusce posuere felis sed lacus. Morbi sem mauris, laoreet ut, rhoncus aliquet, pulvinar sed, nisl.",dogs,Kurdish,West Frisian,Irish Gaelic,Māori,http://dummyimage.com/160x189.bmp/ff4444/ffffff,http://dummyimage.com/214x293.bmp/ff4444/ffffff,http://dummyimage.com/150x180.bmp/cc0000/ffffff,http://dummyimage.com/213x244.jpg/cc0000/ffffff,,http://dummyimage.com/227x129.jpg/5fa2dd/ffffff,4/10/2017
63,63,4,Vision-oriented local synergy,"Aliquam quis turpis eget elit sodales scelerisque. Mauris sit amet eros. Suspendisse accumsan tortor quis turpis.

Sed ante. Vivamus tortor. Duis mattis egestas metus.",Donec quis orci eget orci vehicula condimentum.,monk seal,Lithuanian,Spanish,Luxembourgish,Zulu,http://dummyimage.com/175x175.jpg/5fa2dd/ffffff,,,,,,3/24/2017
64,64,1,Monitored systemic focus group,"Vestibulum ac est lacinia nisi venenatis tristique. Fusce congue, diam id ornare imperdiet, sapien urna pretium nisl, ut volutpat sapien arcu sed augue. Aliquam erat volutpat.

In congue. Etiam justo. Etiam pretium iaculis justo.","Quisque erat eros, viverra eget, congue eget, semper rutrum, nulla.",dogs,Tajik,Sotho,Norwegian,Aymara,http://dummyimage.com/190x128.jpg/cc0000/ffffff,http://dummyimage.com/261x202.png/cc0000/ffffff,,http://dummyimage.com/241x250.jpg/ff4444/ffffff,http://dummyimage.com/175x103.png/dddddd/000000,,3/17/2017
65,65,29,Phased regional local area network,In congue. Etiam justo. Etiam pretium iaculis justo.,Vestibulum ante ipsum primis in faucibus orci luctus et ultrices posuere cubilia Curae; Duis faucibus accumsan odio. Curabitur convallis. Duis consequat dui nec nisi volutpat eleifend.,dogs,Dzongkha,Punjabi,Māori,Polish,http://dummyimage.com/245x142.bmp/5fa2dd/ffffff,http://dummyimage.com/222x246.png/dddddd/000000,http://dummyimage.com/173x152.bmp/ff4444/ffffff,http://dummyimage.com/242x235.png/5fa2dd/ffffff,http://dummyimage.com/152x221.png/ff4444/ffffff,,3/12/2017
66,66,21,Reverse-engineered object-oriented framework,"Cum sociis natoque penatibus et magnis dis parturient montes, nascetur ridiculus mus. Vivamus vestibulum sagittis sapien. Cum sociis natoque penatibus et magnis dis parturient montes, nascetur ridiculus mus.

Etiam vel augue. Vestibulum rutrum rutrum neque. Aenean auctor gravida sem.",Nulla tempus. Vivamus in felis eu sapien cursus vestibulum. Proin eu mi.,surfing,Hebrew,Khmer,Punjabi,Bosnian,http://dummyimage.com/226x104.jpg/cc0000/ffffff,http://dummyimage.com/202x248.png/ff4444/ffffff,,,,http://dummyimage.com/195x162.png/5fa2dd/ffffff,7/16/2016
67,67,20,Intuitive coherent synergy,"Suspendisse potenti. In eleifend quam a odio. In hac habitasse platea dictumst.

Maecenas ut massa quis augue luctus tincidunt. Nulla mollis molestie lorem. Quisque ut erat.","Mauris ullamcorper purus sit amet nulla. Quisque arcu libero, rutrum ac, lobortis vel, dapibus at, diam. Nam tristique tortor eu pede.",no kids,Estonian,Malay,Azeri,Armenian,http://dummyimage.com/227x117.jpg/5fa2dd/ffffff,http://dummyimage.com/233x298.bmp/dddddd/000000,,http://dummyimage.com/215x210.png/5fa2dd/ffffff,,,12/14/2016
68,68,18,Open-source heuristic system engine,Pellentesque at nulla. Suspendisse potenti. Cras in purus eu magna vulputate luctus.,"Integer pede justo, lacinia eget, tincidunt eget, tempus vel, pede. Morbi porttitor lorem id ligula.",restaurant,Fijian,Croatian,Gujarati,Catalan,http://dummyimage.com/185x217.png/ff4444/ffffff,http://dummyimage.com/217x286.bmp/cc0000/ffffff,http://dummyimage.com/155x206.png/5fa2dd/ffffff,http://dummyimage.com/200x245.jpg/5fa2dd/ffffff,http://dummyimage.com/177x195.bmp/5fa2dd/ffffff,,10/18/2016
69,69,23,Versatile object-oriented open system,"Duis bibendum, felis sed interdum venenatis, turpis enim blandit mi, in porttitor pede justo eu massa. Donec dapibus. Duis at velit eu est congue elementum.

In hac habitasse platea dictumst. Morbi vestibulum, velit id pretium iaculis, diam erat fermentum justo, nec condimentum neque sapien placerat ante. Nulla justo.","Proin leo odio, porttitor id, consequat in, consequat ut, nulla.",luau,Amharic,Bislama,Luxembourgish,Malayalam,http://dummyimage.com/182x172.jpg/ff4444/ffffff,http://dummyimage.com/217x229.png/dddddd/000000,http://dummyimage.com/236x250.jpg/ff4444/ffffff,http://dummyimage.com/242x203.jpg/ff4444/ffffff,http://dummyimage.com/159x250.bmp/5fa2dd/ffffff,,4/3/2017
70,70,1,Assimilated object-oriented contingency,"Nam ultrices, libero non mattis pulvinar, nulla pede ullamcorper augue, a suscipit nulla elit ac nulla. Sed vel enim sit amet nunc viverra dapibus. Nulla suscipit ligula in lacus.",Suspendisse potenti. Cras in purus eu magna vulputate luctus.,farm,Quechua,Khmer,Hindi,New Zealand Sign Language,http://dummyimage.com/157x198.jpg/ff4444/ffffff,http://dummyimage.com/246x237.bmp/5fa2dd/ffffff,,http://dummyimage.com/210x244.bmp/5fa2dd/ffffff,http://dummyimage.com/199x132.png/cc0000/ffffff,http://dummyimage.com/210x177.bmp/cc0000/ffffff,7/21/2016
71,71,24,Profound explicit system engine,"Quisque porta volutpat erat. Quisque erat eros, viverra eget, congue eget, semper rutrum, nulla. Nunc purus.",Morbi non lectus.,dogs,Dari,Papiamento,Māori,Sotho,http://dummyimage.com/234x136.png/ff4444/ffffff,http://dummyimage.com/215x231.jpg/cc0000/ffffff,http://dummyimage.com/225x173.jpg/dddddd/000000,http://dummyimage.com/202x212.png/dddddd/000000,http://dummyimage.com/168x180.bmp/cc0000/ffffff,,10/11/2016
72,72,6,Self-enabling local leverage,"Sed ante. Vivamus tortor. Duis mattis egestas metus.

Aenean fermentum. Donec ut mauris eget massa tempor convallis. Nulla neque libero, convallis eget, eleifend luctus, ultricies eu, nibh.",Nullam molestie nibh in lectus. Pellentesque at nulla.,tour,Gagauz,Haitian Creole,French,Norwegian,http://dummyimage.com/110x130.jpg/5fa2dd/ffffff,,http://dummyimage.com/173x192.bmp/dddddd/000000,http://dummyimage.com/243x212.bmp/5fa2dd/ffffff,http://dummyimage.com/209x100.png/5fa2dd/ffffff,,5/31/2016
73,73,5,Devolved intangible application,"Donec diam neque, vestibulum eget, vulputate ut, ultrices vel, augue. Vestibulum ante ipsum primis in faucibus orci luctus et ultrices posuere cubilia Curae; Donec pharetra, magna vestibulum aliquet ultrices, erat tortor sollicitudin mi, sit amet lobortis sapien sapien non mi. Integer ac neque.","In sagittis dui vel nisl. Duis ac nibh. Fusce lacus purus, aliquet at, feugiat non, pretium quis, lectus.",snorkeling,Guaraní,German,Ndebele,Polish,http://dummyimage.com/163x183.bmp/cc0000/ffffff,http://dummyimage.com/245x284.bmp/5fa2dd/ffffff,http://dummyimage.com/219x185.jpg/dddddd/000000,,,http://dummyimage.com/111x215.jpg/dddddd/000000,8/4/2016
74,74,17,Proactive mission-critical policy,"Quisque id justo sit amet sapien dignissim vestibulum. Vestibulum ante ipsum primis in faucibus orci luctus et ultrices posuere cubilia Curae; Nulla dapibus dolor vel est. Donec odio justo, sollicitudin ut, suscipit a, feugiat et, eros.","Morbi vestibulum, velit id pretium iaculis, diam erat fermentum justo, nec condimentum neque sapien placerat ante. Nulla justo.",walking,French,Zulu,Hungarian,Quechua,http://dummyimage.com/103x213.png/cc0000/ffffff,http://dummyimage.com/294x244.png/5fa2dd/ffffff,http://dummyimage.com/240x163.bmp/cc0000/ffffff,http://dummyimage.com/211x223.png/cc0000/ffffff,http://dummyimage.com/139x181.jpg/cc0000/ffffff,,10/30/2016
75,75,3,Public-key bandwidth-monitored knowledge base,"Vestibulum ac est lacinia nisi venenatis tristique. Fusce congue, diam id ornare imperdiet, sapien urna pretium nisl, ut volutpat sapien arcu sed augue. Aliquam erat volutpat.

In congue. Etiam justo. Etiam pretium iaculis justo.",Aliquam sit amet diam in magna bibendum imperdiet.,walking,Armenian,Persian,Tswana,Dzongkha,http://dummyimage.com/136x238.png/dddddd/000000,http://dummyimage.com/285x264.png/dddddd/000000,,,http://dummyimage.com/211x175.jpg/cc0000/ffffff,http://dummyimage.com/229x236.png/ff4444/ffffff,4/24/2016
76,76,26,Inverse dedicated product,"Quisque porta volutpat erat. Quisque erat eros, viverra eget, congue eget, semper rutrum, nulla. Nunc purus.",Nulla ac enim.,drinks,Latvian,Kannada,Sotho,Japanese,http://dummyimage.com/150x169.png/ff4444/ffffff,http://dummyimage.com/225x243.jpg/cc0000/ffffff,http://dummyimage.com/207x234.bmp/5fa2dd/ffffff,http://dummyimage.com/227x215.bmp/cc0000/ffffff,http://dummyimage.com/211x168.jpg/cc0000/ffffff,,9/19/2016
77,77,27,Synchronised logistical intranet,Phasellus in felis. Donec semper sapien a libero. Nam dui.,Mauris lacinia sapien quis libero. Nullam sit amet turpis elementum ligula vehicula consequat.,eating,Latvian,Polish,Swahili,Catalan,http://dummyimage.com/191x229.bmp/dddddd/000000,http://dummyimage.com/219x236.png/5fa2dd/ffffff,,,,,3/11/2017
78,78,16,Synergistic motivating Graphical User Interface,"Lorem ipsum dolor sit amet, consectetuer adipiscing elit. Proin risus. Praesent lectus.

Vestibulum quam sapien, varius ut, blandit non, interdum in, ante. Vestibulum ante ipsum primis in faucibus orci luctus et ultrices posuere cubilia Curae; Duis faucibus accumsan odio. Curabitur convallis.",Quisque id justo sit amet sapien dignissim vestibulum. Vestibulum ante ipsum primis in faucibus orci luctus et ultrices posuere cubilia Curae; Nulla dapibus dolor vel est.,biking,Dhivehi,Bengali,Afrikaans,Bosnian,http://dummyimage.com/178x173.jpg/dddddd/000000,http://dummyimage.com/246x258.png/5fa2dd/ffffff,,,http://dummyimage.com/169x153.jpg/5fa2dd/ffffff,,10/1/2016
79,79,18,Profound even-keeled pricing structure,"Aenean fermentum. Donec ut mauris eget massa tempor convallis. Nulla neque libero, convallis eget, eleifend luctus, ultricies eu, nibh.

Quisque id justo sit amet sapien dignissim vestibulum. Vestibulum ante ipsum primis in faucibus orci luctus et ultrices posuere cubilia Curae; Nulla dapibus dolor vel est. Donec odio justo, sollicitudin ut, suscipit a, feugiat et, eros.","Cum sociis natoque penatibus et magnis dis parturient montes, nascetur ridiculus mus. Vivamus vestibulum sagittis sapien.",dogs,Polish,Oriya,Dutch,Tamil,http://dummyimage.com/140x141.jpg/dddddd/000000,,,http://dummyimage.com/219x233.bmp/cc0000/ffffff,,,4/7/2017
80,80,6,Horizontal eco-centric workforce,"Suspendisse potenti. In eleifend quam a odio. In hac habitasse platea dictumst.

Maecenas ut massa quis augue luctus tincidunt. Nulla mollis molestie lorem. Quisque ut erat.",Nulla suscipit ligula in lacus. Curabitur at ipsum ac tellus semper interdum.,hiking,Swedish,Bulgarian,Tsonga,Belarusian,http://dummyimage.com/156x193.jpg/ff4444/ffffff,http://dummyimage.com/201x239.jpg/dddddd/000000,,,,,8/24/2016
81,81,29,Organized multi-tasking architecture,"Cum sociis natoque penatibus et magnis dis parturient montes, nascetur ridiculus mus. Vivamus vestibulum sagittis sapien. Cum sociis natoque penatibus et magnis dis parturient montes, nascetur ridiculus mus.",Mauris ullamcorper purus sit amet nulla.,drinks,German,Swati,Amharic,Azeri,http://dummyimage.com/241x135.bmp/cc0000/ffffff,http://dummyimage.com/298x243.bmp/dddddd/000000,,,,,8/11/2016
82,82,4,Versatile radical support,"Proin eu mi. Nulla ac enim. In tempor, turpis nec euismod scelerisque, quam turpis adipiscing lorem, vitae mattis nibh ligula nec sem.

Duis aliquam convallis nunc. Proin at turpis a pede posuere nonummy. Integer non velit.",Morbi ut odio.,eating,Danish,Papiamento,Japanese,Northern Sotho,http://dummyimage.com/114x165.png/cc0000/ffffff,http://dummyimage.com/232x298.bmp/cc0000/ffffff,http://dummyimage.com/178x201.bmp/ff4444/ffffff,,http://dummyimage.com/238x187.jpg/dddddd/000000,http://dummyimage.com/134x112.bmp/5fa2dd/ffffff,5/23/2016
83,83,28,Profit-focused maximized data-warehouse,"Praesent blandit. Nam nulla. Integer pede justo, lacinia eget, tincidunt eget, tempus vel, pede.",Vivamus in felis eu sapien cursus vestibulum. Proin eu mi.,farm,Kurdish,Moldovan,Finnish,Tswana,http://dummyimage.com/220x183.jpg/ff4444/ffffff,http://dummyimage.com/257x266.jpg/5fa2dd/ffffff,http://dummyimage.com/195x207.jpg/cc0000/ffffff,http://dummyimage.com/247x203.bmp/dddddd/000000,,,3/1/2017
84,84,9,Cross-platform uniform budgetary management,"Morbi porttitor lorem id ligula. Suspendisse ornare consequat lectus. In est risus, auctor sed, tristique in, tempus sit amet, sem.

Fusce consequat. Nulla nisl. Nunc nisl.","Donec semper sapien a libero. Nam dui. Proin leo odio, porttitor id, consequat in, consequat ut, nulla.",nature,Dutch,Malagasy,Amharic,Hebrew,http://dummyimage.com/111x162.jpg/dddddd/000000,,http://dummyimage.com/163x226.bmp/ff4444/ffffff,,,,12/10/2016
85,85,25,Grass-roots asymmetric capability,"Proin leo odio, porttitor id, consequat in, consequat ut, nulla. Sed accumsan felis. Ut at dolor quis odio consequat varius.

Integer ac leo. Pellentesque ultrices mattis odio. Donec vitae nisi.","Vestibulum ante ipsum primis in faucibus orci luctus et ultrices posuere cubilia Curae; Nulla dapibus dolor vel est. Donec odio justo, sollicitudin ut, suscipit a, feugiat et, eros. Vestibulum ac est lacinia nisi venenatis tristique.",no kids,Swati,Malayalam,German,Dhivehi,http://dummyimage.com/215x160.bmp/5fa2dd/ffffff,http://dummyimage.com/285x243.jpg/cc0000/ffffff,http://dummyimage.com/225x200.jpg/ff4444/ffffff,http://dummyimage.com/227x219.jpg/5fa2dd/ffffff,,,4/24/2016
86,86,11,Decentralized local structure,"Nam ultrices, libero non mattis pulvinar, nulla pede ullamcorper augue, a suscipit nulla elit ac nulla. Sed vel enim sit amet nunc viverra dapibus. Nulla suscipit ligula in lacus.",Duis bibendum. Morbi non quam nec dui luctus rutrum.,art,Japanese,Assamese,Catalan,Dari,http://dummyimage.com/191x105.jpg/5fa2dd/ffffff,http://dummyimage.com/241x262.bmp/cc0000/ffffff,http://dummyimage.com/226x178.png/dddddd/000000,http://dummyimage.com/208x222.bmp/cc0000/ffffff,,,6/29/2016
87,87,25,Customer-focused needs-based project,"In congue. Etiam justo. Etiam pretium iaculis justo.

In hac habitasse platea dictumst. Etiam faucibus cursus urna. Ut tellus.","Maecenas leo odio, condimentum id, luctus nec, molestie sed, justo. Pellentesque viverra pede ac diam. Cras pellentesque volutpat dui.",monk seal,Dari,Kyrgyz,Amharic,Japanese,http://dummyimage.com/144x113.png/ff4444/ffffff,http://dummyimage.com/278x248.png/cc0000/ffffff,http://dummyimage.com/170x245.bmp/dddddd/000000,,http://dummyimage.com/172x132.png/cc0000/ffffff,,3/11/2017
88,88,13,Multi-channelled foreground emulation,"Nullam sit amet turpis elementum ligula vehicula consequat. Morbi a ipsum. Integer a nibh.

In quis justo. Maecenas rhoncus aliquam lacus. Morbi quis tortor id nulla ultrices aliquet.",Suspendisse accumsan tortor quis turpis. Sed ante. Vivamus tortor.,nature,Burmese,Guaraní,Portuguese,Indonesian,http://dummyimage.com/106x159.png/cc0000/ffffff,http://dummyimage.com/276x242.bmp/5fa2dd/ffffff,http://dummyimage.com/187x228.jpg/dddddd/000000,http://dummyimage.com/248x210.jpg/dddddd/000000,http://dummyimage.com/150x215.png/cc0000/ffffff,http://dummyimage.com/199x191.jpg/5fa2dd/ffffff,2/5/2017
89,89,5,Up-sized zero defect knowledge base,Phasellus in felis. Donec semper sapien a libero. Nam dui.,Curabitur gravida nisi at nibh.,walking,English,Tswana,Tajik,Marathi,http://dummyimage.com/157x112.jpg/dddddd/000000,http://dummyimage.com/285x233.png/5fa2dd/ffffff,,http://dummyimage.com/234x207.png/dddddd/000000,,,10/26/2016
90,90,11,Mandatory demand-driven local area network,"Aenean fermentum. Donec ut mauris eget massa tempor convallis. Nulla neque libero, convallis eget, eleifend luctus, ultricies eu, nibh.

Quisque id justo sit amet sapien dignissim vestibulum. Vestibulum ante ipsum primis in faucibus orci luctus et ultrices posuere cubilia Curae; Nulla dapibus dolor vel est. Donec odio justo, sollicitudin ut, suscipit a, feugiat et, eros.","Donec ut dolor. Morbi vel lectus in quam fringilla rhoncus. Mauris enim leo, rhoncus sed, vestibulum sit amet, cursus id, turpis.",food,Dutch,Czech,Ndebele,Georgian,http://dummyimage.com/161x241.png/dddddd/000000,http://dummyimage.com/269x234.bmp/cc0000/ffffff,http://dummyimage.com/232x247.bmp/dddddd/000000,http://dummyimage.com/207x240.png/dddddd/000000,,,8/19/2016
91,91,15,Organic neutral task-force,"Morbi non lectus. Aliquam sit amet diam in magna bibendum imperdiet. Nullam orci pede, venenatis non, sodales sed, tincidunt eu, felis.

Fusce posuere felis sed lacus. Morbi sem mauris, laoreet ut, rhoncus aliquet, pulvinar sed, nisl. Nunc rhoncus dui vel sem.","Lorem ipsum dolor sit amet, consectetuer adipiscing elit. Proin interdum mauris non ligula pellentesque ultrices.",farm,Yiddish,Kannada,Swati,Hebrew,http://dummyimage.com/240x225.jpg/5fa2dd/ffffff,http://dummyimage.com/274x282.png/dddddd/000000,,http://dummyimage.com/201x222.bmp/cc0000/ffffff,,,5/30/2016
