id,fk_provider_id,fk_type_id,slogan,description,short_description,keywords,language_spoken1,language_spoken2,language_spoken3,language_spoken4,image_path_1,image_path_2,image_path_3,image_path_4,video_image_1,video_image_2,reg_date
92,92,16,Fundamental maximized firmware,"Quisque id justo sit amet sapien dignissim vestibulum. Vestibulum ante ipsum primis in faucibus orci luctus et ultrices posuere cubilia Curae; Nulla dapibus dolor vel est. Donec odio justo, sollicitudin ut, suscipit a, feugiat et, eros.",Nulla ut erat id mauris vulputate elementum. Nullam varius.,luau,Tsonga,Tajik,Lao,Estonian,http://dummyimage.com/195x131.bmp/cc0000/ffffff,http://dummyimage.com/222x298.bmp/ff4444/ffffff,,http://dummyimage.com/233x244.png/dddddd/000000,,,9/5/2016
93,93,17,User-friendly encompassing encryption,Aliquam quis turpis eget elit sodales scelerisque. Mauris sit amet eros. Suspendisse accumsan tortor quis turpis.,Quisque ut erat. Curabitur gravida nisi at nibh. In hac habitasse platea dictumst.,hiking,Gujarati,Somali,Malagasy,New Zealand Sign Language,http://dummyimage.com/127x226.png/dddddd/000000,http://dummyimage.com/209x200.bmp/ff4444/ffffff,http://dummyimage.com/162x151.png/ff4444/ffffff,http://dummyimage.com/250x230.bmp/5fa2dd/ffffff,,,3/20/2017
94,94,11,Realigned object-oriented secured line,"Integer ac leo. Pellentesque ultrices mattis odio. Donec vitae nisi.

Nam ultrices, libero non mattis pulvinar, nulla pede ullamcorper augue, a suscipit nulla elit ac nulla. Sed vel enim sit amet nunc viverra dapibus. Nulla suscipit ligula in lacus.","In tempor, turpis nec euismod scelerisque, quam turpis adipiscing lorem, vitae mattis nibh ligula nec sem.",monk seal,Burmese,Hebrew,Dutch,Afrikaans,http://dummyimage.com/181x111.jpg/ff4444/ffffff,http://dummyimage.com/279x207.bmp/5fa2dd/ffffff,,http://dummyimage.com/245x228.png/cc0000/ffffff,,,9/23/2016
95,95,28,Business-focused grid-enabled strategy,Nullam porttitor lacus at turpis. Donec posuere metus vitae ipsum. Aliquam non mauris.,Vestibulum ante ipsum primis in faucibus orci luctus et ultrices posuere cubilia Curae; Nulla dapibus dolor vel est.,monk seal,French,Luxembourgish,Malayalam,Hiri Motu,http://dummyimage.com/159x186.jpg/ff4444/ffffff,http://dummyimage.com/238x300.bmp/dddddd/000000,http://dummyimage.com/229x170.jpg/ff4444/ffffff,,,http://dummyimage.com/134x236.jpg/5fa2dd/ffffff,12/24/2016
96,96,19,Robust context-sensitive frame,Duis consequat dui nec nisi volutpat eleifend. Donec ut dolor. Morbi vel lectus in quam fringilla rhoncus.,Donec dapibus.,biking,Azeri,Burmese,Kurdish,Telugu,http://dummyimage.com/200x202.jpg/ff4444/ffffff,http://dummyimage.com/281x200.bmp/dddddd/000000,http://dummyimage.com/214x204.jpg/5fa2dd/ffffff,http://dummyimage.com/241x210.png/5fa2dd/ffffff,http://dummyimage.com/153x128.jpg/cc0000/ffffff,,8/9/2016
97,97,25,Down-sized client-driven protocol,"Lorem ipsum dolor sit amet, consectetuer adipiscing elit. Proin risus. Praesent lectus.

Vestibulum quam sapien, varius ut, blandit non, interdum in, ante. Vestibulum ante ipsum primis in faucibus orci luctus et ultrices posuere cubilia Curae; Duis faucibus accumsan odio. Curabitur convallis.","Quisque arcu libero, rutrum ac, lobortis vel, dapibus at, diam. Nam tristique tortor eu pede.",farm,Dari,Portuguese,Mongolian,Tamil,http://dummyimage.com/117x169.jpg/ff4444/ffffff,http://dummyimage.com/246x267.jpg/ff4444/ffffff,http://dummyimage.com/175x162.png/ff4444/ffffff,,,,4/19/2017
98,98,12,Function-based value-added instruction set,Fusce consequat. Nulla nisl. Nunc nisl.,Aliquam sit amet diam in magna bibendum imperdiet.,farm,Hungarian,Greek,Burmese,Dutch,http://dummyimage.com/212x173.jpg/5fa2dd/ffffff,http://dummyimage.com/230x233.bmp/cc0000/ffffff,http://dummyimage.com/202x210.bmp/ff4444/ffffff,http://dummyimage.com/216x244.png/ff4444/ffffff,http://dummyimage.com/135x107.bmp/dddddd/000000,,9/22/2016
99,99,2,Fully-configurable motivating architecture,"In sagittis dui vel nisl. Duis ac nibh. Fusce lacus purus, aliquet at, feugiat non, pretium quis, lectus.

Suspendisse potenti. In eleifend quam a odio. In hac habitasse platea dictumst.",Aliquam quis turpis eget elit sodales scelerisque.,hawaiian,West Frisian,Armenian,Estonian,Somali,http://dummyimage.com/245x238.png/dddddd/000000,http://dummyimage.com/219x239.jpg/ff4444/ffffff,http://dummyimage.com/190x243.bmp/5fa2dd/ffffff,,http://dummyimage.com/188x204.bmp/dddddd/000000,,10/19/2016
100,100,6,Horizontal real-time strategy,Duis consequat dui nec nisi volutpat eleifend. Donec ut dolor. Morbi vel lectus in quam fringilla rhoncus.,Donec ut mauris eget massa tempor convallis.,walking,Italian,Montenegrin,Montenegrin,Kannada,http://dummyimage.com/198x102.bmp/5fa2dd/ffffff,http://dummyimage.com/286x268.bmp/5fa2dd/ffffff,http://dummyimage.com/202x185.bmp/cc0000/ffffff,,,,8/18/2016
101,1,19,Streamlined eco-centric time-frame,"In hac habitasse platea dictumst. Morbi vestibulum, velit id pretium iaculis, diam erat fermentum justo, nec condimentum neque sapien placerat ante. Nulla justo.

Aliquam quis turpis eget elit sodales scelerisque. Mauris sit amet eros. Suspendisse accumsan tortor quis turpis.","Donec ut mauris eget massa tempor convallis. Nulla neque libero, convallis eget, eleifend luctus, ultricies eu, nibh. Quisque id justo sit amet sapien dignissim vestibulum.",restaurant,Sotho,Zulu,Afrikaans,Polish,http://dummyimage.com/169x211.jpg/dddddd/000000,http://dummyimage.com/217x219.jpg/dddddd/000000,http://dummyimage.com/234x176.png/cc0000/ffffff,,,,11/16/2016
102,2,22,Future-proofed non-volatile database,"Maecenas tristique, est et tempus semper, est quam pharetra magna, ac consequat metus sapien ut nunc. Vestibulum ante ipsum primis in faucibus orci luctus et ultrices posuere cubilia Curae; Mauris viverra diam vitae quam. Suspendisse potenti.","In hac habitasse platea dictumst. Morbi vestibulum, velit id pretium iaculis, diam erat fermentum justo, nec condimentum neque sapien placerat ante. Nulla justo.",21 and over,Norwegian,Dari,Catalan,Malagasy,http://dummyimage.com/214x248.bmp/5fa2dd/ffffff,,,,,,8/31/2016
103,3,18,Decentralized cohesive Graphic Interface,"Etiam vel augue. Vestibulum rutrum rutrum neque. Aenean auctor gravida sem.

Praesent id massa id nisl venenatis lacinia. Aenean sit amet justo. Morbi ut odio.",Integer ac leo. Pellentesque ultrices mattis odio.,dogs,Papiamento,German,Persian,Bislama,http://dummyimage.com/195x105.png/5fa2dd/ffffff,http://dummyimage.com/220x292.bmp/dddddd/000000,http://dummyimage.com/182x160.jpg/ff4444/ffffff,http://dummyimage.com/207x226.png/ff4444/ffffff,http://dummyimage.com/148x131.jpg/5fa2dd/ffffff,,8/23/2016
104,4,25,Optimized multi-state workforce,"Sed sagittis. Nam congue, risus semper porta volutpat, quam pede lobortis ligula, sit amet eleifend pede libero quis orci. Nullam molestie nibh in lectus.

Pellentesque at nulla. Suspendisse potenti. Cras in purus eu magna vulputate luctus.",In quis justo. Maecenas rhoncus aliquam lacus. Morbi quis tortor id nulla ultrices aliquet.,snorkeling,Japanese,Arabic,Kashmiri,Tswana,http://dummyimage.com/122x216.bmp/ff4444/ffffff,,,http://dummyimage.com/223x237.bmp/dddddd/000000,http://dummyimage.com/248x195.bmp/ff4444/ffffff,,7/6/2016
105,5,2,Extended directional superstructure,"Morbi porttitor lorem id ligula. Suspendisse ornare consequat lectus. In est risus, auctor sed, tristique in, tempus sit amet, sem.",Ut tellus. Nulla ut erat id mauris vulputate elementum.,monk seal,Hindi,English,Swati,Hiri Motu,http://dummyimage.com/213x175.bmp/5fa2dd/ffffff,http://dummyimage.com/232x270.bmp/5fa2dd/ffffff,http://dummyimage.com/215x223.png/ff4444/ffffff,http://dummyimage.com/215x207.bmp/cc0000/ffffff,,,7/22/2016
106,6,13,Profit-focused leading edge emulation,"Fusce posuere felis sed lacus. Morbi sem mauris, laoreet ut, rhoncus aliquet, pulvinar sed, nisl. Nunc rhoncus dui vel sem.

Sed sagittis. Nam congue, risus semper porta volutpat, quam pede lobortis ligula, sit amet eleifend pede libero quis orci. Nullam molestie nibh in lectus.",Nullam varius.,hiking,Tok Pisin,Dari,Greek,Kurdish,http://dummyimage.com/250x123.png/cc0000/ffffff,http://dummyimage.com/247x261.bmp/ff4444/ffffff,,,http://dummyimage.com/166x194.bmp/dddddd/000000,,1/2/2017
107,7,26,Operative maximized frame,"Curabitur gravida nisi at nibh. In hac habitasse platea dictumst. Aliquam augue quam, sollicitudin vitae, consectetuer eget, rutrum at, lorem.",In hac habitasse platea dictumst.,luau,Tswana,Thai,Pashto,Lithuanian,http://dummyimage.com/193x102.bmp/dddddd/000000,http://dummyimage.com/287x289.bmp/ff4444/ffffff,,,,,3/24/2017
108,8,21,Synergized upward-trending moratorium,"Quisque porta volutpat erat. Quisque erat eros, viverra eget, congue eget, semper rutrum, nulla. Nunc purus.

Phasellus in felis. Donec semper sapien a libero. Nam dui.",Pellentesque eget nunc. Donec quis orci eget orci vehicula condimentum.,cooking,Amharic,Hebrew,Belarusian,Polish,http://dummyimage.com/123x250.jpg/5fa2dd/ffffff,http://dummyimage.com/276x285.jpg/5fa2dd/ffffff,,,,http://dummyimage.com/216x165.jpg/5fa2dd/ffffff,12/14/2016
109,9,28,Innovative heuristic ability,"Maecenas tristique, est et tempus semper, est quam pharetra magna, ac consequat metus sapien ut nunc. Vestibulum ante ipsum primis in faucibus orci luctus et ultrices posuere cubilia Curae; Mauris viverra diam vitae quam. Suspendisse potenti.",Aliquam non mauris. Morbi non lectus.,surfing,Italian,Papiamento,German,Kannada,http://dummyimage.com/189x157.bmp/5fa2dd/ffffff,http://dummyimage.com/286x255.png/5fa2dd/ffffff,,http://dummyimage.com/200x219.png/cc0000/ffffff,,,11/3/2016
110,10,1,Sharable systemic budgetary management,Nullam porttitor lacus at turpis. Donec posuere metus vitae ipsum. Aliquam non mauris.,"Mauris ullamcorper purus sit amet nulla. Quisque arcu libero, rutrum ac, lobortis vel, dapibus at, diam.",food,Norwegian,Polish,Italian,Azeri,http://dummyimage.com/101x138.bmp/ff4444/ffffff,http://dummyimage.com/283x216.png/dddddd/000000,,,http://dummyimage.com/132x127.bmp/5fa2dd/ffffff,,1/17/2017
111,11,20,Pre-emptive optimizing circuit,"Cras non velit nec nisi vulputate nonummy. Maecenas tincidunt lacus at velit. Vivamus vel nulla eget eros elementum pellentesque.

Quisque porta volutpat erat. Quisque erat eros, viverra eget, congue eget, semper rutrum, nulla. Nunc purus.","Nam ultrices, libero non mattis pulvinar, nulla pede ullamcorper augue, a suscipit nulla elit ac nulla.",nature,Hungarian,Irish Gaelic,Chinese,Punjabi,http://dummyimage.com/113x126.jpg/dddddd/000000,http://dummyimage.com/265x226.png/cc0000/ffffff,http://dummyimage.com/176x242.bmp/cc0000/ffffff,http://dummyimage.com/226x249.png/5fa2dd/ffffff,http://dummyimage.com/163x209.jpg/dddddd/000000,,2/8/2017
112,12,3,Persistent executive firmware,"Vestibulum quam sapien, varius ut, blandit non, interdum in, ante. Vestibulum ante ipsum primis in faucibus orci luctus et ultrices posuere cubilia Curae; Duis faucibus accumsan odio. Curabitur convallis.

Duis consequat dui nec nisi volutpat eleifend. Donec ut dolor. Morbi vel lectus in quam fringilla rhoncus.","Nulla neque libero, convallis eget, eleifend luctus, ultricies eu, nibh. Quisque id justo sit amet sapien dignissim vestibulum.",food,Dhivehi,Lithuanian,Zulu,Gujarati,http://dummyimage.com/188x162.jpg/ff4444/ffffff,,,,,,1/7/2017
113,13,13,Multi-tiered 4th generation service-desk,Aliquam quis turpis eget elit sodales scelerisque. Mauris sit amet eros. Suspendisse accumsan tortor quis turpis.,"Suspendisse potenti. Cras in purus eu magna vulputate luctus. Cum sociis natoque penatibus et magnis dis parturient montes, nascetur ridiculus mus.",instagram,Hebrew,Hindi,English,Armenian,http://dummyimage.com/145x188.jpg/ff4444/ffffff,http://dummyimage.com/257x288.bmp/cc0000/ffffff,,http://dummyimage.com/225x202.bmp/5fa2dd/ffffff,http://dummyimage.com/180x214.jpg/5fa2dd/ffffff,,8/27/2016
114,14,10,Digitized even-keeled emulation,"Vestibulum ac est lacinia nisi venenatis tristique. Fusce congue, diam id ornare imperdiet, sapien urna pretium nisl, ut volutpat sapien arcu sed augue. Aliquam erat volutpat.

In congue. Etiam justo. Etiam pretium iaculis justo.","Nam congue, risus semper porta volutpat, quam pede lobortis ligula, sit amet eleifend pede libero quis orci.",snorkeling,Tok Pisin,Malayalam,West Frisian,Dhivehi,http://dummyimage.com/101x202.png/ff4444/ffffff,,,http://dummyimage.com/213x249.jpg/dddddd/000000,http://dummyimage.com/157x226.png/cc0000/ffffff,,3/15/2017
115,15,21,Programmable tangible support,"Curabitur in libero ut massa volutpat convallis. Morbi odio odio, elementum eu, interdum eu, tincidunt in, leo. Maecenas pulvinar lobortis est.

Phasellus sit amet erat. Nulla tempus. Vivamus in felis eu sapien cursus vestibulum.",Suspendisse accumsan tortor quis turpis. Sed ante.,21 and over,Finnish,Aymara,Bosnian,Persian,http://dummyimage.com/164x162.bmp/dddddd/000000,http://dummyimage.com/273x277.jpg/dddddd/000000,http://dummyimage.com/197x182.png/ff4444/ffffff,,,,7/12/2016
116,16,3,Decentralized fault-tolerant budgetary management,"Aenean fermentum. Donec ut mauris eget massa tempor convallis. Nulla neque libero, convallis eget, eleifend luctus, ultricies eu, nibh.

Quisque id justo sit amet sapien dignissim vestibulum. Vestibulum ante ipsum primis in faucibus orci luctus et ultrices posuere cubilia Curae; Nulla dapibus dolor vel est. Donec odio justo, sollicitudin ut, suscipit a, feugiat et, eros.",Nulla facilisi. Cras non velit nec nisi vulputate nonummy.,eating,Croatian,Marathi,Hungarian,Zulu,http://dummyimage.com/121x162.jpg/5fa2dd/ffffff,http://dummyimage.com/210x232.bmp/ff4444/ffffff,http://dummyimage.com/151x159.jpg/5fa2dd/ffffff,http://dummyimage.com/217x249.png/dddddd/000000,,http://dummyimage.com/219x116.png/ff4444/ffffff,7/19/2016
117,17,21,Reverse-engineered discrete paradigm,Duis bibendum. Morbi non quam nec dui luctus rutrum. Nulla tellus.,"Aenean fermentum. Donec ut mauris eget massa tempor convallis. Nulla neque libero, convallis eget, eleifend luctus, ultricies eu, nibh.",eating,Chinese,Romanian,Italian,French,http://dummyimage.com/226x186.bmp/cc0000/ffffff,http://dummyimage.com/237x287.png/dddddd/000000,http://dummyimage.com/226x206.png/5fa2dd/ffffff,,,,5/7/2016
118,18,27,Intuitive foreground data-warehouse,"Suspendisse potenti. In eleifend quam a odio. In hac habitasse platea dictumst.

Maecenas ut massa quis augue luctus tincidunt. Nulla mollis molestie lorem. Quisque ut erat.","Donec diam neque, vestibulum eget, vulputate ut, ultrices vel, augue. Vestibulum ante ipsum primis in faucibus orci luctus et ultrices posuere cubilia Curae; Donec pharetra, magna vestibulum aliquet ultrices, erat tortor sollicitudin mi, sit amet lobortis sapien sapien non mi.",luau,Amharic,Malay,Nepali,Marathi,http://dummyimage.com/156x202.png/cc0000/ffffff,http://dummyimage.com/285x276.png/5fa2dd/ffffff,http://dummyimage.com/177x214.bmp/dddddd/000000,,http://dummyimage.com/199x163.png/ff4444/ffffff,,12/5/2016
119,19,20,Streamlined non-volatile alliance,"Praesent blandit. Nam nulla. Integer pede justo, lacinia eget, tincidunt eget, tempus vel, pede.

Morbi porttitor lorem id ligula. Suspendisse ornare consequat lectus. In est risus, auctor sed, tristique in, tempus sit amet, sem.","Nulla neque libero, convallis eget, eleifend luctus, ultricies eu, nibh. Quisque id justo sit amet sapien dignissim vestibulum. Vestibulum ante ipsum primis in faucibus orci luctus et ultrices posuere cubilia Curae; Nulla dapibus dolor vel est.",walking,Kashmiri,Swati,Hindi,Burmese,http://dummyimage.com/115x130.png/cc0000/ffffff,http://dummyimage.com/270x209.bmp/dddddd/000000,http://dummyimage.com/164x196.jpg/cc0000/ffffff,,,,7/7/2016
120,20,21,Seamless stable Graphic Interface,"Curabitur in libero ut massa volutpat convallis. Morbi odio odio, elementum eu, interdum eu, tincidunt in, leo. Maecenas pulvinar lobortis est.

Phasellus sit amet erat. Nulla tempus. Vivamus in felis eu sapien cursus vestibulum.","Aliquam augue quam, sollicitudin vitae, consectetuer eget, rutrum at, lorem. Integer tincidunt ante vel ipsum.",food,Tok Pisin,Persian,Punjabi,Luxembourgish,http://dummyimage.com/229x223.jpg/ff4444/ffffff,http://dummyimage.com/268x287.jpg/dddddd/000000,,http://dummyimage.com/236x215.jpg/5fa2dd/ffffff,,,7/5/2016
121,21,9,Triple-buffered radical conglomeration,"Integer tincidunt ante vel ipsum. Praesent blandit lacinia erat. Vestibulum sed magna at nunc commodo placerat.

Praesent blandit. Nam nulla. Integer pede justo, lacinia eget, tincidunt eget, tempus vel, pede.","Donec vitae nisi. Nam ultrices, libero non mattis pulvinar, nulla pede ullamcorper augue, a suscipit nulla elit ac nulla.",luau,Croatian,Tok Pisin,Romanian,Tajik,http://dummyimage.com/132x125.jpg/ff4444/ffffff,http://dummyimage.com/276x300.jpg/5fa2dd/ffffff,,http://dummyimage.com/222x212.png/5fa2dd/ffffff,http://dummyimage.com/219x112.png/ff4444/ffffff,,5/21/2016
122,22,15,Progressive directional internet solution,"Mauris enim leo, rhoncus sed, vestibulum sit amet, cursus id, turpis. Integer aliquet, massa id lobortis convallis, tortor risus dapibus augue, vel accumsan tellus nisi eu orci. Mauris lacinia sapien quis libero.",Suspendisse potenti. Nullam porttitor lacus at turpis.,hawaiian,Swati,Swati,Dari,Icelandic,http://dummyimage.com/196x120.jpg/ff4444/ffffff,http://dummyimage.com/241x265.png/ff4444/ffffff,http://dummyimage.com/248x186.bmp/dddddd/000000,http://dummyimage.com/201x242.png/dddddd/000000,,,12/16/2016
123,23,3,Advanced empowering open system,In congue. Etiam justo. Etiam pretium iaculis justo.,"Nam congue, risus semper porta volutpat, quam pede lobortis ligula, sit amet eleifend pede libero quis orci.",food,Japanese,Sotho,Māori,Malayalam,http://dummyimage.com/142x193.bmp/cc0000/ffffff,,http://dummyimage.com/205x170.png/dddddd/000000,,,,1/25/2017
124,24,26,Optional optimal parallelism,Etiam vel augue. Vestibulum rutrum rutrum neque. Aenean auctor gravida sem.,"Aliquam augue quam, sollicitudin vitae, consectetuer eget, rutrum at, lorem. Integer tincidunt ante vel ipsum.",art,Macedonian,Finnish,Lao,Kurdish,http://dummyimage.com/122x130.jpg/ff4444/ffffff,http://dummyimage.com/236x243.png/ff4444/ffffff,,http://dummyimage.com/241x216.png/dddddd/000000,http://dummyimage.com/194x243.png/dddddd/000000,,5/12/2016
125,25,24,Automated upward-trending paradigm,"Fusce posuere felis sed lacus. Morbi sem mauris, laoreet ut, rhoncus aliquet, pulvinar sed, nisl. Nunc rhoncus dui vel sem.",Vivamus vel nulla eget eros elementum pellentesque.,monk seal,Malayalam,Haitian Creole,Irish Gaelic,Burmese,http://dummyimage.com/158x231.jpg/ff4444/ffffff,http://dummyimage.com/203x237.bmp/cc0000/ffffff,,,,http://dummyimage.com/122x239.bmp/cc0000/ffffff,6/25/2016
126,26,22,Multi-layered high-level time-frame,"Vestibulum ac est lacinia nisi venenatis tristique. Fusce congue, diam id ornare imperdiet, sapien urna pretium nisl, ut volutpat sapien arcu sed augue. Aliquam erat volutpat.

In congue. Etiam justo. Etiam pretium iaculis justo.",Sed ante. Vivamus tortor. Duis mattis egestas metus.,tour,Dhivehi,Maltese,Telugu,Yiddish,http://dummyimage.com/146x250.png/cc0000/ffffff,http://dummyimage.com/249x284.jpg/cc0000/ffffff,http://dummyimage.com/202x244.jpg/5fa2dd/ffffff,http://dummyimage.com/232x206.bmp/ff4444/ffffff,,,3/4/2017
127,27,1,Multi-tiered needs-based array,"Quisque porta volutpat erat. Quisque erat eros, viverra eget, congue eget, semper rutrum, nulla. Nunc purus.

Phasellus in felis. Donec semper sapien a libero. Nam dui.",Aliquam non mauris.,monk seal,Dutch,Assamese,Dutch,Filipino,http://dummyimage.com/244x142.jpg/dddddd/000000,http://dummyimage.com/232x209.bmp/5fa2dd/ffffff,http://dummyimage.com/202x155.png/5fa2dd/ffffff,,http://dummyimage.com/190x137.jpg/5fa2dd/ffffff,,2/21/2017
128,28,14,Devolved intermediate methodology,"Vestibulum ac est lacinia nisi venenatis tristique. Fusce congue, diam id ornare imperdiet, sapien urna pretium nisl, ut volutpat sapien arcu sed augue. Aliquam erat volutpat.

In congue. Etiam justo. Etiam pretium iaculis justo.",Donec dapibus. Duis at velit eu est congue elementum. In hac habitasse platea dictumst.,luau,Quechua,Aymara,Kannada,Punjabi,http://dummyimage.com/196x220.png/cc0000/ffffff,,http://dummyimage.com/180x176.png/dddddd/000000,http://dummyimage.com/238x215.bmp/cc0000/ffffff,,,12/16/2016
129,29,15,Advanced well-modulated synergy,Nullam sit amet turpis elementum ligula vehicula consequat. Morbi a ipsum. Integer a nibh.,Pellentesque at nulla. Suspendisse potenti.,snorkeling,Azeri,Malayalam,Fijian,Hindi,http://dummyimage.com/125x195.jpg/cc0000/ffffff,http://dummyimage.com/280x223.bmp/5fa2dd/ffffff,http://dummyimage.com/157x205.bmp/cc0000/ffffff,http://dummyimage.com/222x218.bmp/dddddd/000000,http://dummyimage.com/156x218.png/ff4444/ffffff,http://dummyimage.com/160x183.png/dddddd/000000,5/4/2016
130,30,30,Reduced scalable contingency,"Proin interdum mauris non ligula pellentesque ultrices. Phasellus id sapien in sapien iaculis congue. Vivamus metus arcu, adipiscing molestie, hendrerit at, vulputate vitae, nisl.

Aenean lectus. Pellentesque eget nunc. Donec quis orci eget orci vehicula condimentum.",Nullam molestie nibh in lectus. Pellentesque at nulla. Suspendisse potenti.,eating,Telugu,Tamil,Irish Gaelic,Bulgarian,http://dummyimage.com/194x180.jpg/dddddd/000000,http://dummyimage.com/294x289.jpg/ff4444/ffffff,,,http://dummyimage.com/121x125.png/5fa2dd/ffffff,http://dummyimage.com/124x222.png/cc0000/ffffff,8/14/2016
131,31,30,Triple-buffered intangible extranet,"Curabitur gravida nisi at nibh. In hac habitasse platea dictumst. Aliquam augue quam, sollicitudin vitae, consectetuer eget, rutrum at, lorem.",Suspendisse accumsan tortor quis turpis. Sed ante. Vivamus tortor.,nature,Mongolian,Amharic,Oriya,Tamil,http://dummyimage.com/243x243.jpg/dddddd/000000,,http://dummyimage.com/161x172.bmp/ff4444/ffffff,,,,3/23/2017
132,32,18,Optional upward-trending secured line,"Nam ultrices, libero non mattis pulvinar, nulla pede ullamcorper augue, a suscipit nulla elit ac nulla. Sed vel enim sit amet nunc viverra dapibus. Nulla suscipit ligula in lacus.","Donec vitae nisi. Nam ultrices, libero non mattis pulvinar, nulla pede ullamcorper augue, a suscipit nulla elit ac nulla. Sed vel enim sit amet nunc viverra dapibus.",monk seal,Georgian,New Zealand Sign Language,Marathi,Kurdish,http://dummyimage.com/225x198.jpg/cc0000/ffffff,http://dummyimage.com/265x254.bmp/dddddd/000000,http://dummyimage.com/209x204.jpg/cc0000/ffffff,,,http://dummyimage.com/155x153.jpg/ff4444/ffffff,12/14/2016
133,33,14,Centralized bandwidth-monitored hub,"Lorem ipsum dolor sit amet, consectetuer adipiscing elit. Proin risus. Praesent lectus.",Donec vitae nisi.,luau,Tajik,Dari,Spanish,Telugu,http://dummyimage.com/226x100.bmp/dddddd/000000,,http://dummyimage.com/178x231.bmp/dddddd/000000,,,,2/3/2017
134,34,3,Public-key reciprocal analyzer,"Integer tincidunt ante vel ipsum. Praesent blandit lacinia erat. Vestibulum sed magna at nunc commodo placerat.

Praesent blandit. Nam nulla. Integer pede justo, lacinia eget, tincidunt eget, tempus vel, pede.",In congue.,instagram,Tsonga,Swati,Fijian,Croatian,http://dummyimage.com/160x149.png/cc0000/ffffff,http://dummyimage.com/293x207.png/5fa2dd/ffffff,,http://dummyimage.com/214x221.bmp/cc0000/ffffff,http://dummyimage.com/213x191.bmp/cc0000/ffffff,http://dummyimage.com/101x124.png/dddddd/000000,2/23/2017
135,35,15,Innovative mobile array,"Curabitur in libero ut massa volutpat convallis. Morbi odio odio, elementum eu, interdum eu, tincidunt in, leo. Maecenas pulvinar lobortis est.","Cum sociis natoque penatibus et magnis dis parturient montes, nascetur ridiculus mus. Etiam vel augue. Vestibulum rutrum rutrum neque.",surfing,Japanese,Latvian,Catalan,Dhivehi,http://dummyimage.com/121x154.jpg/dddddd/000000,http://dummyimage.com/267x300.bmp/cc0000/ffffff,,,,,5/24/2016
136,36,22,Cloned exuding standardization,"Praesent blandit. Nam nulla. Integer pede justo, lacinia eget, tincidunt eget, tempus vel, pede.","Cras in purus eu magna vulputate luctus. Cum sociis natoque penatibus et magnis dis parturient montes, nascetur ridiculus mus. Vivamus vestibulum sagittis sapien.",cooking,Tsonga,Italian,Hungarian,Romanian,http://dummyimage.com/224x108.bmp/ff4444/ffffff,http://dummyimage.com/209x284.bmp/dddddd/000000,,http://dummyimage.com/219x203.bmp/ff4444/ffffff,,,9/2/2016
137,37,2,Decentralized 5th generation knowledge user,"Curabitur at ipsum ac tellus semper interdum. Mauris ullamcorper purus sit amet nulla. Quisque arcu libero, rutrum ac, lobortis vel, dapibus at, diam.",Duis aliquam convallis nunc. Proin at turpis a pede posuere nonummy. Integer non velit.,no kids,Latvian,Indonesian,Tajik,Māori,http://dummyimage.com/153x176.png/ff4444/ffffff,http://dummyimage.com/282x205.png/dddddd/000000,http://dummyimage.com/210x173.bmp/dddddd/000000,,,,2/4/2017
138,38,16,Upgradable 24 hour local area network,"In quis justo. Maecenas rhoncus aliquam lacus. Morbi quis tortor id nulla ultrices aliquet.

Maecenas leo odio, condimentum id, luctus nec, molestie sed, justo. Pellentesque viverra pede ac diam. Cras pellentesque volutpat dui.","Cum sociis natoque penatibus et magnis dis parturient montes, nascetur ridiculus mus.",tour,Luxembourgish,Dzongkha,Mongolian,Afrikaans,http://dummyimage.com/140x174.jpg/ff4444/ffffff,http://dummyimage.com/285x213.png/ff4444/ffffff,http://dummyimage.com/177x210.bmp/ff4444/ffffff,http://dummyimage.com/239x221.png/cc0000/ffffff,,,6/6/2016
139,39,29,Multi-lateral tangible challenge,"Morbi porttitor lorem id ligula. Suspendisse ornare consequat lectus. In est risus, auctor sed, tristique in, tempus sit amet, sem.",Donec ut mauris eget massa tempor convallis.,hawaiian,English,Icelandic,Icelandic,New Zealand Sign Language,http://dummyimage.com/223x136.jpg/ff4444/ffffff,http://dummyimage.com/246x243.bmp/dddddd/000000,,http://dummyimage.com/225x210.png/ff4444/ffffff,http://dummyimage.com/209x206.jpg/dddddd/000000,,1/30/2017
